,Date,R,Casa v Visitante,-
21,03/31 17:12,-,Liverpool (taka) EsportsvArsenal (Flewless_phoenix) Esports,0-1
22,03/31 17:12,-,Tottenham (PASHOK75) EsportsvMan City (kalibra) Esports,1-1
23,03/31 17:06,-,Liverpool (Olle) EsportsvMan City (BlackStar98) Esports,1-3
24,03/31 17:06,-,PSG (Chellovekk) EsportsvBarcelona (Pablik) Soccer,3-0
25,03/31 16:54,-,Real Madrid (mooneycb) EsportsvPSG (Chellovekk) Esports,0-1
26,03/31 16:54,-,Barcelona (Pablik) SoccervLiverpool (Olle) Esports,1-4
27,03/31 16:48,-,Man City (kalibra) EsportsvMan United (fearggwp) Esports,1-1
28,03/31 16:48,-,Tottenham (PASHOK75) EsportsvLiverpool (taka) Esports,2-2
29,03/31 16:42,-,Man City (BlackStar98) EsportsvBarcelona (Pablik) Soccer,3-2
0,03/31 21:30,-,Portugal (Flewless_phoenix) EsportsvGermany (FEARGGWP) Esports,0-0
1,03/31 21:18,-,Man City (Kray) EsportsvTottenham (MeLToSiK) Esports,3-1
2,03/31 21:18,-,Man Utd (KraftVK) EsportsvArsenal (labotryas) Esports,0-1
3,03/31 21:18,-,Spain (PASHOK75) EsportsvFrance (TAKA) Esports,2-2
4,03/31 21:18,-,Belgium (kalibra) EsportsvGermany (FEARGGWP) Esports,0-0
5,03/31 21:07,-,Man City (Kray) EsportsvArsenal (labotryas) Esports,3-2
6,03/31 21:06,-,Portugal (Flewless_phoenix) EsportsvBelgium (kalibra) Esports,1-1
7,03/31 21:06,-,Germany (FEARGGWP) EsportsvSpain (PASHOK75) Esports,4-0
8,03/31 20:54,-,France (TAKA) EsportsvGermany (FEARGGWP) Esports,0-1
9,03/31 20:54,-,Spain (PASHOK75) EsportsvPortugal (Flewless_phoenix) Esports,2-1
10,03/31 20:53,-,Man City (Kray) EsportsvLiverpool (Upcake22) Esports,0-1
11,03/31 20:52,-,Tottenham (MeLToSiK) EsportsvArsenal (labotryas) Esports,1-1
12,03/31 20:47,-,Man Utd (KraftVK) EsportsvMan City (Kray) Esports,1-1
13,03/31 20:43,-,Portugal (Flewless_phoenix) EsportsvFrance (TAKA) Esports,1-0
14,03/31 20:42,-,Belgium (kalibra) EsportsvSpain (PASHOK75) Esports,0-0
15,03/31 20:41,-,Liverpool (Upcake22) EsportsvTottenham (MeLToSiK) Esports,1-2
16,03/31 20:34,-,France (TAKA) EsportsvBelgium (kalibra) Esports,3-1
17,03/31 20:30,-,Germany (FEARGGWP) EsportsvPortugal (Flewless_phoenix) Esports,1-0
18,03/31 20:18,-,Chelsea (FEARGGWP) EsportsvInter (kalibra) Esports,1-0
19,03/31 20:18,-,Dortmund (taka) EsportsvAtletico Madrid (PASHOK75) Esports,3-0
20,03/31 20:06,-,Inter (kalibra) EsportsvAjax (Flewless_phoenix) Esports,1-2
21,03/31 20:06,-,Atletico Madrid (PASHOK75) EsportsvChelsea (FEARGGWP) Esports,1-1
22,03/31 19:54,-,Chelsea (FEARGGWP) EsportsvDortmund (taka) Esports,2-0
23,03/31 19:54,-,Ajax (Flewless_phoenix) EsportsvAtletico Madrid (PASHOK75) Esports,0-1
24,03/31 19:45,-,Atletico Madrid (PASHOK75) EsportsvInter (kalibra) Esports,2-3
25,03/31 19:42,-,Dortmund (taka) EsportsvAjax (Flewless_phoenix) Esports,0-4
26,03/31 19:18,-,Atletico Madrid (PASHOK75) EsportsvDortmund (taka) Esports,1-0
27,03/31 19:18,-,Inter (kalibra) EsportsvChelsea (FEARGGWP) Esports,1-0
28,03/31 19:06,-,Ajax (Flewless_phoenix) EsportsvInter (kalibra) Esports,0-0
29,03/31 19:06,-,Chelsea (FEARGGWP) EsportsvAtletico Madrid (PASHOK75) Esports,0-2
0,03/31 23:18,-,PSG (Kray) EsportsvNapoli (MeLToSiK) Esports,1-1
1,03/31 23:18,-,Real Madrid (KRaftVK) EsportsvTottenham (labotryas) Esports,2-3
2,03/31 23:06,-,Bayern (Upcake22) EsportsvReal Madrid (KRaftVK) Esports,0-3
3,03/31 23:06,-,Tottenham (labotryas) EsportsvPSG (Kray) Esports,1-0
4,03/31 22:54,-,Napoli (MeLToSiK) EsportsvTottenham (labotryas) Esports,1-1
5,03/31 22:49,-,Bayern (Upcake22) EsportsvPSG (Kray) Esports,0-3
6,03/31 22:49,-,Napoli (MeLToSiK) EsportsvBayern (Upcake22) Esports,4-0
7,03/31 22:42,-,Real Madrid (KRaftVK) EsportsvPSG (Kray) Esports,0-0
8,03/31 22:24,-,PSG (Kray) EsportsvBayern (Upcake22) Esports,0-3
9,03/31 22:24,-,Bayern (Upcake22) EsportsvNapoli (MeLToSiK) Esports,0-0
10,03/31 22:24,-,Tottenham (labotryas) EsportsvBayern (Upcake22) Esports,0-3
11,03/31 22:22,-,Napoli (MeLToSiK) EsportsvReal Madrid (KRaftVK) Esports,1-0
12,03/31 22:18,-,Arsenal (labotryas) EsportsvMan Utd (KraftVK) Esports,0-2
13,03/31 22:18,-,Man City (Kray) EsportsvTottenham (MeLToSiK) Esports,0-0
14,03/31 22:18,-,Germany (FEARGGWP) EsportsvBelgium (kalibra) Esports,3-3
15,03/31 22:18,-,France (TAKA) EsportsvSpain (PASHOK75) Esports,2-0
16,03/31 22:06,-,Spain (PASHOK75) EsportsvGermany (FEARGGWP) Esports,1-1
17,03/31 22:06,-,Man Utd (KraftVK) EsportsvLiverpool (Upcake22) Esports,2-1
18,03/31 22:06,-,Belgium (kalibra) EsportsvPortugal (Flewless_phoenix) Esports,1-0
19,03/31 21:54,-,Arsenal (labotryas) EsportsvTottenham (MeLToSiK) Esports,1-0
20,03/31 21:54,-,Liverpool (Upcake22) EsportsvMan City (Kray) Esports,0-0
21,03/31 21:54,-,Germany (FEARGGWP) EsportsvFrance (TAKA) Esports,2-0
22,03/31 21:54,-,Portugal (Flewless_phoenix) EsportsvSpain (PASHOK75) Esports,3-1
23,03/31 21:42,-,France (TAKA) EsportsvPortugal (Flewless_phoenix) Esports,0-0
24,03/31 21:42,-,Tottenham (Upcake22) EsportsvLiverpool (Upcake22) Esports,0-0
25,03/31 21:42,-,Man City (Kray) EsportsvMan Utd (KraftVK) Esports,2-2
26,03/31 21:42,-,Spain (PASHOK75) EsportsvBelgium (kalibra) Esports,4-1
27,03/31 21:30,-,Belgium (kalibra) EsportsvFrance (TAKA) Esports,2-2
28,03/31 21:30,-,Man Utd (KraftVK) EsportsvTottenham (MeLToSiK) Esports,0-2
29,03/31 21:30,-,Liverpool (Upcake22) EsportsvArsenal (labotryas) Esports,2-0
0,04/01 03:12,-,France (KRaftVK) EsportsvGermany (Kray) Esports,1-1
1,04/01 03:12,-,Belgium (Upcake22) EsportsvPortugal (MeLToSiK) Esports,1-2
2,04/01 03:00,-,Spain (labotryas) EsportsvBelgium (Upcake22) Esports,0-1
3,04/01 03:00,-,Portugal (MeLToSiK) EsportsvFrance (KRaftVK) Esports,1-1
4,04/01 02:48,-,Atletico Madrid (MeLToSiK) EsportsvAjax (Kray) Esports,2-1
5,04/01 02:48,-,Inter (labotryas) EsportsvChelsea (KRaftVK) Esports,1-3
6,04/01 02:36,-,Ajax (Kray) EsportsvInter (labotryas) Esports,0-2
7,04/01 02:36,-,Chelsea (KRaftVK) EsportsvDortmund (Upcake22) Esports,1-0
8,04/01 02:24,-,Dortmund (Upcake22) EsportsvAjax (Kray) Esports,2-0
9,04/01 02:24,-,Inter (labotryas) EsportsvAtletico Madrid (MeLToSiK) Esports,1-0
10,04/01 02:12,-,Ajax (Kray) EsportsvChelsea (KRaftVK) Esports,2-2
11,04/01 02:00,-,Dortmund (Upcake22) EsportsvInter (labotryas) Esports,1-1
12,04/01 02:00,-,Chelsea (KRaftVK) EsportsvAtletico Madrid (MeLToSiK) Esports,0-0
13,04/01 01:49,-,Chelsea (KRaftVK) EsportsvInter (labotryas) Esports,0-1
14,04/01 01:49,-,Ajax (Kray) EsportsvAtletico Madrid (MeLToSiK) Esports,5-3
15,04/01 01:36,-,Inter (labotryas) EsportsvAjax (Kray) Esports,0-2
16,04/01 01:24,-,Ajax (Kray) EsportsvDortmund (Upcake22) Esports,0-2
17,04/01 01:24,-,Atletico Madrid (MeLToSiK) EsportsvInter (labotryas) Esports,1-1
18,04/01 01:12,-,Chelsea (KRaftVK) EsportsvAjax (Kray) Esports,1-0
19,04/01 01:04,-,Atletico Madrid (MeLToSiK) EsportsvDortmund (Upcake22) Esports,1-1
20,04/01 01:00,-,Inter (labotryas) EsportsvDortmund (Upcake22) Esports,0-0
21,04/01 00:52,-,Atletico Madrid (MeLToSiK) EsportsvChelsea (KRaftVK) Esports,1-1
22,04/01 00:20,-,Napoli (MeLToSiK) EsportsvPSG (Kray) Esports,1-0
23,04/01 00:19,-,Tottenham (labotryas) EsportsvReal Madrid (KRaftVK) Esports,1-3
24,04/01 00:07,-,Real Madrid (KRaftVK) EsportsvBayern (Upcake22) Esports,1-1
25,04/01 00:06,-,PSG (Kray) EsportsvTottenham (labotryas) Esports,1-1
26,03/31 23:55,-,Tottenham (labotryas) EsportsvNapoli (MeLToSiK) Esports,1-0
27,03/31 23:42,-,PSG (Kray) EsportsvReal Madrid (KRaftVK) Esports,1-1
28,03/31 23:30,-,Real Madrid (KRaftVK) EsportsvNapoli (MeLToSiK) Esports,3-1
29,03/31 23:30,-,Bayern (Upcake22) EsportsvTottenham (labotryas) Esports,0-1
0,04/01 05:42,-,Lok Moscow (Skromnuy) EsportsvSpartak Moscow (Lomik) Esports,1-0
1,04/01 05:42,-,CSKA Moscow (Arcos) EsportsvDyn Kyiv (Boulevard_Prospect) Esports,0-0
2,04/01 05:36,-,Real Madrid (Foggy) EsportsvLiverpool (nikkitta) Esports,1-2
3,04/01 05:36,-,PSG (DangerDim77) EsportsvBarcelona (Hrusch) Esports,0-0
4,04/01 05:30,-,Lok Moscow (Skromnuy) EsportsvCSKA Moscow (Arcos) Esports,0-2
5,04/01 05:30,-,Shakhtar Donetsk (Mr.Jab) EsportsvSpartak Moscow (Lomik) Esports,2-2
6,04/01 05:24,-,Barcelona (Hrusch) EsportsvReal Madrid (Foggy) Esports,1-0
7,04/01 05:24,-,Man City (orlovsky1) EsportsvPSG (DangerDim77) Esports,2-0
8,04/01 05:22,-,Lok Moscow (Skromnuy) EsportsvShakhtar Donetsk (Mr.Jab) Esports,0-1
9,04/01 05:15,-,Spartak Moscow (Lomik) EsportsvLok Moscow (Skromnuy) Esports,1-0
10,04/01 05:12,-,Real Madrid (Foggy) EsportsvMan City (orlovsky1) Esports,0-2
11,04/01 05:12,-,Liverpool (nikkitta) EsportsvBarcelona (Hrusch) Esports,2-0
12,04/01 05:00,-,Man City (orlovsky1) EsportsvLiverpool (nikkitta) Esports,1-3
13,04/01 04:48,-,Spain (labotryas) EsportsvFrance (KRaftVK) Esports,5-1
14,04/01 04:48,-,Portugal (MeLToSiK) EsportsvGermany (Kray) Esports,4-1
15,04/01 04:46,-,PSG (DangerDim77) EsportsvReal Madrid (Foggy) Esports,2-1
16,04/01 04:36,-,Germany (Kray) EsportsvSpain (labotryas) Esports,2-1
17,04/01 04:36,-,France (KRaftVK) EsportsvBelgium (Upcake22) Esports,0-0
18,04/01 04:24,-,Belgium (Upcake22) EsportsvGermany (Kray) Esports,0-2
19,04/01 04:24,-,Spain (labotryas) EsportsvPortugal (MeLToSiK) Esports,2-0
20,04/01 04:12,-,Portugal (MeLToSiK) EsportsvBelgium (Upcake22) Esports,0-0
21,04/01 04:12,-,Germany (Kray) EsportsvFrance (KRaftVK) Esports,0-0
22,04/01 04:00,-,Belgium (Upcake22) EsportsvSpain (labotryas) Esports,0-2
23,04/01 04:00,-,France (KRaftVK) EsportsvPortugal (MeLToSiK) Esports,1-1
24,04/01 03:48,-,Germany (Kray) EsportsvPortugal (MeLToSiK) Esports,2-0
25,04/01 03:48,-,France (KRaftVK) EsportsvSpain (labotryas) Esports,0-0
26,04/01 03:36,-,Belgium (Upcake22) EsportsvFrance (KRaftVK) Esports,1-1
27,04/01 03:36,-,Spain (labotryas) EsportsvGermany (Kray) Esports,2-3
28,04/01 03:24,-,Germany (Kray) EsportsvBelgium (Upcake22) Esports,0-3
29,04/01 03:24,-,Portugal (MeLToSiK) EsportsvSpain (labotryas) Esports,0-4
0,04/01 07:18,-,Lok Moscow (Skromnuy) EsportsvDyn Kyiv (Boulevard_Prospect) Esports,0-0
1,04/01 07:18,-,Shakhtar Donetsk (Mr.Jab) EsportsvCSKA Moscow (Arcos) Esports,2-2
2,04/01 07:13,-,Man City (nikkitta) EsportsvMan Utd (Hrusch) Esports,1-1
3,04/01 07:12,-,Arsenal (Foggy) EsportsvTottenham (orlovsky1) Esports,2-0
4,04/01 07:06,-,CSKA Moscow (Arcos) EsportsvSpartak Moscow (Lomik) Esports,0-1
5,04/01 07:06,-,Dyn Kyiv (Boulevard_Prospect) EsportsvShakhtar Donetsk (Mr.Jab) Esports,0-0
6,04/01 07:02,-,Liverpool (DangerDim77) EsportsvArsenal (Foggy) Esports,1-5
7,04/01 07:00,-,Tottenham (orlovsky1) EsportsvMan City (nikkitta) Esports,2-1
8,04/01 06:54,-,Spartak Moscow (Lomik) EsportsvDyn Kyiv (Boulevard_Prospect) Esports,0-1
9,04/01 06:48,-,Man City (orlovsky1) EsportsvBarcelona (Hrusch) Esports,0-1
10,04/01 06:48,-,PSG (DangerDim77) EsportsvLiverpool (nikkitta) Esports,0-0
11,04/01 06:42,-,Dyn Kyiv (Boulevard_Prospect) EsportsvCSKA Moscow (Arcos) Esports,0-1
12,04/01 06:36,-,Liverpool (nikkitta) EsportsvReal Madrid (Foggy) Esports,1-2
13,04/01 06:36,-,Barcelona (Hrusch) EsportsvPSG (DangerDim77) Esports,2-1
14,04/01 06:30,-,Spartak Moscow (Lomik) EsportsvShakhtar Donetsk (Mr.Jab) Esports,1-5
15,04/01 06:30,-,CSKA Moscow (Arcos) EsportsvLok Moscow (Skromnuy) Esports,3-0
16,04/01 06:24,-,PSG (DangerDim77) EsportsvManCity (orlovsky1) Esports,2-3
17,04/01 06:24,-,Real Madrid (Foggy) EsportsvBarcelona (Hrusch) Esports,1-2
18,04/01 06:18,-,Dyn Kyiv (Boulevard_Prospect) EsportsvLok Moscow (Skromnuy) Esports,0-0
19,04/01 06:18,-,CSKA Moscow (Arcos) EsportsvShakhtar Donetsk (Mr.Jab) Esports,2-2
20,04/01 06:12,-,Barcelona (Hrusch) EsportsvLiverpool (nikkitta) Esports,0-1
21,04/01 06:12,-,Man City (orlovsky1) EsportsvReal Madrid (Foggy) Esports,0-0
22,04/01 06:06,-,Spartak Moscow (Lomik) EsportsvCSKA Moscow (Arcos) Esports,2-1
23,04/01 06:06,-,Shakhtar Donetsk (Mr.Jab) EsportsvDyn Kyiv (Boulevard_Prospect) Esports,1-0
24,04/01 06:00,-,Real Madrid (Foggy) EsportsvPSG (DangerDim77) Esports,0-0
25,04/01 06:00,-,Liverpool (nikkitta) EsportsvManCity (orlovsky1) Esports,1-2
26,04/01 05:54,-,Dyn Kyiv (Boulevard_Prospect) EsportsvSpartak Moscow (Lomik) Esports,0-0
27,04/01 05:53,-,Shakhtar Donetsk (Mr.Jab) EsportsvLok Moscow (Skromnuy) Esports,2-0
28,04/01 05:48,-,Liverpool (nikkitta) EsportsvPSG (DangerDim77) Esports,2-0
29,04/01 05:48,-,Barcelona (Hrusch) EsportsvManCity (orlovsky1) Esports,1-3
0,04/01 09:06,-,M'Gladbach (Boulevard_Prospect) EsportsvBayern (Mr.Jab) Esports,1-0
1,04/01 08:54,-,Leverkusen (Lomik) EsportsvM'Gladbach (Boulevard_Prospect) Esports,1-2
2,04/01 08:54,-,Bayern (Mr.Jab) EsportsvDortmund (Skromnuy) Esports,1-2
3,04/01 08:48,-,Liverpool (DangerDim77) EsportsvMan City (nikkitta) Esports,2-0
4,04/01 08:48,-,Tottenham (orlovsky1) EsportsvMan Utd (Hrusch) Esports,0-2
5,04/01 08:42,-,Dortmund (Skromnuy) EsportsvLeverkusen (Lomik) Esports,3-1
6,04/01 08:36,-,Man Utd (Hrusch) EsportsvLiverpool (DangerDim77) Esports,1-0
7,04/01 08:36,-,Man City (nikkitta) EsportsvArsenal (Foggy) Esports,1-0
8,04/01 08:30,-,Leipzig (Arcos) EsportsvDortmund (Skromnuy) Esports,4-0
9,04/01 08:24,-,Arsenal (Foggy) EsportsvMan Utd (Hrusch) Esports,1-1
10,04/01 08:18,-,M'Gladbach (Boulevard_Prospect) EsportsvDortmund (Skromnuy) Esports,0-1
11,04/01 08:18,-,Leipzig (Arcos) EsportsvBayern (Mr.Jab) Esports,2-1
12,04/01 08:12,-,Tottenham (orlovsky1) EsportsvArsenal (Foggy) Esports,2-0
13,04/01 08:12,-,Man Utd (Hrusch) EsportsvMan City (nikkitta) Esports,0-1
14,04/01 08:06,-,Bayern (Mr.Jab) EsportsvM'Gladbach (Boulevard_Prospect) Esports,1-3
15,04/01 08:06,-,Leverkusen (Lomik) EsportsvLeipzig (Arcos) Esports,0-3
16,04/01 08:00,-,Arsenal (Foggy) EsportsvLiverpool (DangerDim77) Esports,1-1
17,04/01 08:00,-,Man City (nikkitta) EsportsvTottenham (orlovsky1) Esports,0-0
18,04/01 07:54,-,M'Gladbach (Boulevard_Prospect) EsportsvLeverkusen (Lomik) Esports,4-0
19,04/01 07:54,-,Dortmund (Skromnuy) EsportsvBayern (Mr.Jab) Esports,1-2
20,04/01 07:48,-,Man Utd (Hrusch) EsportsvTottenham (orlovsky1) Esports,3-0
21,04/01 07:48,-,Man City (nikkitta) EsportsvLiverpool (DangerDim77) Esports,1-2
22,04/01 07:37,-,Arsenal (Foggy) EsportsvMan City (nikkitta) Esports,3-0
23,04/01 07:36,-,M'Gladbach (Boulevard_Prospect) EsportsvLeipzig (Arcos) Esports,0-2
24,04/01 07:36,-,Leverkusen (Lomik) EsportsvBayern (Mr.Jab) Esports,0-0
25,04/01 07:36,-,Liverpool (DangerDim77) EsportsvMan Utd (Hrusch) Esports,1-0
26,04/01 07:33,-,Leverkusen (Lomik) EsportsvDortmund (Skromnuy) Esports,0-2
27,04/01 07:32,-,Dortmund (Skromnuy) EsportsvLeipzig (Arcos) Esports,2-1
28,04/01 07:25,-,Liverpool (DangerDim77) EsportsvTottenham (orlovsky1) Esports,2-3
29,04/01 07:24,-,Man Utd (Hrusch) EsportsvArsenal (Foggy) Esports,3-2
0,04/01 10:54,-,Napoli (DangerDim77) EsportsvBayern (orlovsky1) Esports,1-3
1,04/01 10:52,-,PSG (Foggy) EsportsvReal Madrid (Hrusch) Esports,0-0
2,04/01 10:48,-,Arsenal (SALAYYY) EsportsvTottenham (mooneycb) Esports,0-1
3,04/01 10:48,-,Man Utd (Inquisitor) EsportsvLiverpool (Chellovekk) Esports,2-0
4,04/01 10:42,-,Real Madrid (Hrusch) EsportsvTottenham (nikkitta) Esports,0-1
5,04/01 10:40,-,Bayern (orlovsky1) EsportsvPSG (Foggy) Esports,2-2
6,04/01 10:36,-,Man City (Olle) EsportsvMan Utd (Inquisitor) Esports,1-2
7,04/01 10:36,-,Liverpool (Chellovekk) EsportsvArsenal (SALAYYY) Esports,0-0
8,04/01 10:30,-,PSG (Foggy) EsportsvNapoli (DangerDim77) Esports,3-0
9,04/01 10:28,-,Tottenham (nikkitta) EsportsvBayern (orlovsky1) Esports,0-1
10,04/01 10:24,-,Tottenham (mooneycb) EsportsvLiverpool (Chellovekk) Esports,0-1
11,04/01 10:22,-,Man City (Olle) EsportsvArsenal (SALAYYY) Esports,4-0
12,04/01 10:18,-,Real Madrid (Hrusch) EsportsvBayern (orlovsky1) Esports,1-2
13,04/01 10:15,-,Tottenham (nikkitta) EsportsvNapoli (DangerDim77) Esports,1-0
14,04/01 10:06,-,Arsenal (SALAYYY) EsportsvMan Utd (Inquisitor) Esports,1-0
15,04/01 10:06,-,PSG (Foggy) EsportsvTottenham (nikkitta) Esports,1-1
16,04/01 10:05,-,Napoli (DangerDim77) EsportsvReal Madrid (Hrusch) Esports,2-0
17,04/01 10:05,-,Man City (Olle) EsportsvTottenham (mooneycb) Esports,2-0
18,04/01 10:00,-,Man City (Olle) EsportsvLiverpool (Chellovekk) Esports,0-0
19,04/01 10:00,-,Tottenham (mooneycb) EsportsvMan Utd (Inquisitor) Esports,1-0
20,04/01 09:54,-,Bayern (orlovsky1) EsportsvNapoli (DangerDim77) Esports,2-1
21,04/01 09:54,-,Real Madrid (Hrusch) EsportsvPSG (Foggy) Esports,0-1
22,04/01 09:42,-,Tottenham (nikkitta) EsportsvReal Madrid (Hrusch) Esports,0-0
23,04/01 09:42,-,PSG (Foggy) EsportsvBayern (orlovsky1) Esports,1-1
24,04/01 09:31,-,Bayern (orlovsky1) EsportsvTottenham (nikkitta) Esports,1-0
25,04/01 09:31,-,Napoli (DangerDim77) EsportsvPSG (Foggy) Esports,2-0
26,04/01 09:26,-,Bayern (orlovsky1) EsportsvReal Madrid (Hrusch) Esports,2-1
27,04/01 09:18,-,Bayern (Mr.Jab) EsportsvLeipzig (Arcos) Esports,0-1
28,04/01 09:18,-,Dortmund (Skromnuy) EsportsvM'Gladbach (Boulevard_Prospect) Esports,0-1
29,04/01 09:06,-,Leipzig (Arcos) EsportsvLeverkusen (Lomik) Esports,1-0
0,04/01 12:30,-,Italy (Foggy) EsportsvPortugal (DangerDim77) Esports,1-1
1,04/01 12:24,-,Brazil (SALAYYY) EsportsvSpain (Olle) Esports,3-1
2,04/01 12:18,-,Portugal (Chellovekk) EsportsvBelgium (mooneycb) Esports,0-2
3,04/01 12:18,-,England (Hrusch) EsportsvNetherlands (orlovsky1) Esports,2-2
4,04/01 12:18,-,Spain (nikkitta) EsportsvPortugal (DangerDim77) Esports,1-0
5,04/01 12:12,-,Spain (Olle) EsportsvBelgium (mooneycb) Esports,2-1
6,04/01 12:12,-,Germany (Inquisitor) EsportsvBrazil (SALAYYY) Esports,1-2
7,04/01 12:06,-,Portugal (DangerDim77) EsportsvEngland (Hrusch) Esports,0-3
8,04/01 12:06,-,Italy (Foggy) EsportsvSpain (nikkitta) Esports,0-0
9,04/01 12:00,-,Portugal (Chellovekk) EsportsvSpain (Olle) Esports,2-2
10,04/01 11:58,-,Belgium (mooneycb) EsportsvPortugal (Chellovekk) Esports,0-3
11,04/01 11:57,-,Belgium (mooneycb) EsportsvGermany (Inquisitor) Esports,0-0
12,04/01 11:54,-,England (Hrusch) EsportsvItaly (Foggy) Esports,1-4
13,04/01 11:54,-,Netherlands (orlovsky1) EsportsvPortugal (DangerDim77) Esports,0-0
14,04/01 11:48,-,Liverpool (Chellovekk) EsportsvMan Utd (Inquisitor) Esports,1-1
15,04/01 11:48,-,Tottenham (mooneycb) EsportsvArsenal (SALAYYY) Esports,3-0
16,04/01 11:44,-,Portugal (DangerDim77) EsportsvEngland (Hrusch) Esports,0-3
17,04/01 11:42,-,England (Hrusch) EsportsvNetherlands (orlovsky1) Esports,2-2
18,04/01 11:42,-,Italy (Foggy) EsportsvNetherlands (orlovsky1) Esports,1-1
19,04/01 11:42,-,Spain (nikkitta) EsportsvEngland (Hrusch) Esports,1-0
20,04/01 11:36,-,Arsenal (SALAYYY) EsportsvLiverpool (Chellovekk) Esports,0-3
21,04/01 11:36,-,Man Utd (Inquisitor) EsportsvMan City (Olle) Esports,0-1
22,04/01 11:30,-,Portugal (DangerDim77) EsportsvItaly (Foggy) Esports,2-1
23,04/01 11:30,-,Netherlands (orlovsky1) EsportsvSpain (nikkitta) Esports,2-0
24,04/01 11:24,-,Liverpool (Chellovekk) EsportsvTottenham (mooneycb) Esports,0-1
25,04/01 11:24,-,Man City (Olle) EsportsvArsenal (SALAYYY) Esports,4-0
26,04/01 11:18,-,Napoli (DangerDim77) EsportsvTottenham (nikkitta) Esports,0-0
27,04/01 11:12,-,Tottenham (mooneycb) EsportsvMan City (Olle) Esports,1-0
28,04/01 11:04,-,Real Madrid (Hrusch) EsportsvNapoli (DangerDim77) Esports,0-0
29,04/01 11:00,-,Man Utd (Inquisitor) EsportsvTottenham (mooneycb) Esports,2-0
0,04/01 14:30,-,Porto (Chellovekk) EsportsvValencia (Olle) Esports,1-0
1,04/01 14:30,-,Man Utd (mooneycb) EsportsvAjax (Inquisitor) Esports,5-0
2,04/01 14:24,-,PSG (BlackStar98) EsportsvBayern (Flewless_phoenix) Esports,0-2
3,04/01 14:24,-,Real Madrid (PASHOK75) EsportsvNapoli (FEARGGWP) Esports,0-1
4,04/01 14:12,-,Bayern (Flewless_phoenix) EsportsvReal Madrid (PASHOK75) Esports,0-0
5,04/01 14:08,-,Tottenham (kalibra) EsportsvPSG (BlackStar98) Esports,0-0
6,04/01 14:00,-,Real Madrid (PASHOK75) EsportsvTottenham (kalibra) Esports,1-1
7,04/01 14:00,-,Napoli (FEARGGWP) EsportsvBayern (Flewless_phoenix) Esports,0-0
8,04/01 13:48,-,Portugal (Chellovekk) EsportsvGermany (Inquisitor) Esports,2-0
9,04/01 13:48,-,Belgium (mooneycb) EsportsvBrazil (SALAYYY) Esports,1-1
10,04/01 13:36,-,Brazil (SALAYYY) EsportsvPortugal (Chellovekk) Esports,0-1
11,04/01 13:36,-,Germany (Inquisitor) EsportsvSpain (Olle) Esports,1-1
12,04/01 13:24,-,Spain (Olle) EsportsvBrazil (SALAYYY) Esports,0-3
13,04/01 13:18,-,Netherlands (orlovsky1) EsportsvEngland (Hrusch) Esports,2-2
14,04/01 13:18,-,Portugal (DangerDim77) EsportsvSpain (nikkitta) Esports,2-1
15,04/01 13:12,-,Belgium (mooneycb) EsportsvSpain (Olle) Esports,4-1
16,04/01 13:12,-,Brazil (SALAYYY) EsportsvGermany (Inquisitor) Esports,2-2
17,04/01 13:06,-,England (Hrusch) EsportsvPortugal (DangerDim77) Esports,0-0
18,04/01 13:06,-,Spain (nikkitta) EsportsvItaly (Foggy) Esports,0-0
19,04/01 13:00,-,Spain (Olle) EsportsvPortugal (Chellovekk) Esports,1-1
20,04/01 13:00,-,Germany (Inquisitor) EsportsvBelgium (mooneycb) Esports,2-2
21,04/01 12:54,-,Italy (Foggy) EsportsvEngland (Hrusch) Esports,1-1
22,04/01 12:54,-,Portugal (DangerDim77) EsportsvNetherlands (orlovsky1) Esports,1-1
23,04/01 12:48,-,Germany (Inquisitor) EsportsvPortugal (Chellovekk) Esports,0-0
24,04/01 12:48,-,Brazil (SALAYYY) EsportsvBelgium (mooneycb) Esports,0-0
25,04/01 12:42,-,England (Hrusch) EsportsvSpain (nikkitta) Esports,2-1
26,04/01 12:42,-,Netherlands (orlovsky1) EsportsvItaly (Foggy) Esports,1-0
27,04/01 12:36,-,Portugal (Chellovekk) EsportsvBrazil (SALAYYY) Esports,2-1
28,04/01 12:36,-,Spain (Olle) EsportsvGermany (Inquisitor) Esports,0-1
29,04/01 12:30,-,Spain (nikkitta) EsportsvNetherlands (orlovsky1) Esports,1-0
0,04/01 16:00,-,Arsenal (PASHOK75) EsportsvMan City (kalibra) Esports,0-0
1,04/01 16:00,-,Tottenham (FEARGGWP) EsportsvMan United (Flewless_phoenix) Esports,2-0
2,04/01 15:54,-,Valencia (Olle) EsportsvLeverkusen (SALAYYY) Esports,0-3
3,04/01 15:54,-,Porto (Chellovekk) EsportsvMan Utd (mooneycb) Esports,0-0
4,04/01 15:48,-,Real Madrid (PASHOK75) EsportsvPSG (BlackStar98) Esports,0-0
5,04/01 15:48,-,Napoli (FEARGGWP) EsportsvTottenham (kalibra) Esports,2-2
6,04/01 15:42,-,Man Utd (mooneycb) EsportsvValencia (Olle) Esports,0-0
7,04/01 15:42,-,Leverkusen (SALAYYY) EsportsvAjax (Inquisitor) Esports,2-0
8,04/01 15:36,-,PSG (BlackStar98) EsportsvNapoli (FEARGGWP) Esports,0-2
9,04/01 15:36,-,Tottenham (kalibra) EsportsvBayern (Flewless_phoenix) Esports,0-1
10,04/01 15:30,-,Ajax (Inquisitor) EsportsvMan Utd (mooneycb) Esports,0-0
11,04/01 15:30,-,Valencia (Olle) EsportsvPorto (Chellovekk) Esports,1-3
12,04/01 15:24,-,Bayern (Flewless_phoenix) EsportsvPSG (BlackStar98) Esports,3-1
13,04/01 15:24,-,Napoli (FEARGGWP) EsportsvReal Madrid (PASHOK75) Esports,2-1
14,04/01 15:18,-,Ajax (Inquisitor) EsportsvPorto (Chellovekk) Esports,0-0
15,04/01 15:18,-,Leverkusen (SALAYYY) EsportsvMan Utd (mooneycb) Esports,0-3
16,04/01 15:12,-,Real Madrid (PASHOK75) EsportsvBayern (Flewless_phoenix) Esports,0-0
17,04/01 15:12,-,PSG (BlackStar98) EsportsvTottenham (kalibra) Esports,0-2
18,04/01 15:06,-,Porto (Chellovekk) EsportsvLeverkusen (SALAYYY) Esports,0-3
19,04/01 15:06,-,Valencia (Olle) EsportsvAjax (Inquisitor) Esports,0-2
20,04/01 15:00,-,Tottenham (kalibra) EsportsvReal Madrid (PASHOK75) Esports,0-0
21,04/01 15:00,-,Bayern (Flewless_phoenix) EsportsvNapoli (FEARGGWP) Esports,1-1
22,04/01 14:54,-,Leverkusen (SALAYYY) EsportsvValencia (Olle) Esports,2-1
23,04/01 14:54,-,Man Utd (mooneycb) EsportsvPorto (Chellovekk) Esports,0-1
24,04/01 14:48,-,Tottenham (kalibra) EsportsvNapoli (FEARGGWP) Esports,0-0
25,04/01 14:48,-,PSG (BlackStar98) EsportsvReal Madrid (PASHOK75) Esports,1-1
26,04/01 14:42,-,Valencia (Olle) EsportsvMan Utd (mooneycb) Esports,1-0
27,04/01 14:42,-,Ajax (Inquisitor) EsportsvLeverkusen (SALAYYY) Esports,2-2
28,04/01 14:36,-,Napoli (FEARGGWP) EsportsvPSG (BlackStar98) Esports,0-2
29,04/01 14:36,-,Bayern (Flewless_phoenix) EsportsvTottenham (kalibra) Esports,1-0
0,04/01 17:30,-,Liverpool (Inquisitor) EsportsvMan City (mooneycb) Esports,2-1
1,04/01 17:30,-,Real Madrid (Olle) EsportsvBarcelona (Chellovekk) Esports,0-0
2,04/01 17:24,-,Man United (Flewless_phoenix) EsportsvLiverpool (BlackStar98) Esports,1-0
3,04/01 17:24,-,Tottenham (FEARGGWP) EsportsvArsenal (PASHOK75) Esports,0-1
4,04/01 17:18,-,Liverpool (Inquisitor) EsportsvBarcelona (Chellovekk) Esports,0-1
5,04/01 17:18,-,PSG (SALAYYY) EsportsvMan City (mooneycb) Esports,1-0
6,04/01 17:12,-,Arsenal (PASHOK75) EsportsvMan United (Flewless_phoenix) Esports,2-2
7,04/01 17:12,-,Liverpool (BlackStar98) EsportsvMan City (kalibra) Esports,0-0
8,04/01 17:06,-,Real Madrid (Olle) EsportsvLiverpool (Inquisitor) Esports,0-0
9,04/01 17:06,-,Barcelona (Chellovekk) EsportsvPSG (SALAYYY) Esports,0-1
10,04/01 17:00,-,Man City (kalibra) EsportsvArsenal (PASHOK75) Esports,0-0
11,04/01 17:00,-,Man United (Flewless_phoenix) EsportsvTottenham (FEARGGWP) Esports,1-1
12,04/01 16:54,-,PSG (SALAYYY) EsportsvReal Madrid (Olle) Esports,0-1
13,04/01 16:54,-,Man City (mooneycb) EsportsvBarcelona (Chellovekk) Esports,1-1
14,04/01 16:48,-,Man City (kalibra) EsportsvTottenham (FEARGGWP) Esports,1-1
15,04/01 16:48,-,Liverpool (BlackStar98) EsportsvArsenal (PASHOK75) Esports,1-1
16,04/01 16:42,-,Liverpool (Inquisitor) EsportsvPSG (SALAYYY) Esports,1-0
17,04/01 16:42,-,Real Madrid (Olle) EsportsvMan City (mooneycb) Esports,1-2
18,04/01 16:36,-,Tottenham (FEARGGWP) EsportsvLiverpool (BlackStar98) Esports,1-3
19,04/01 16:36,-,Man United (Flewless_phoenix) EsportsvMan City (kalibra) Esports,1-1
20,04/01 16:30,-,Barcelona (Chellovekk) EsportsvReal Madrid (Olle) Esports,1-2
21,04/01 16:30,-,Liverpool (Inquisitor) EsportsvMan City (mooneycb) Esports,3-1
22,04/01 16:24,-,Liverpool (BlackStar98) EsportsvMan United (Flewless_phoenix) Esports,1-0
23,04/01 16:24,-,Arsenal (PASHOK75) EsportsvTottenham (FEARGGWP) Esports,2-0
24,04/01 16:18,-,Porto (Chellovekk) EsportsvAjax (Inquisitor) Esports,1-2
25,04/01 16:18,-,Man Utd (mooneycb) EsportsvLeverkusen (SALAYYY) Esports,2-2
26,04/01 16:12,-,Man City (kalibra) EsportsvLiverpool (BlackStar98) Esports,1-0
27,04/01 16:12,-,Man United (Flewless_phoenix) EsportsvArsenal (PASHOK75) Esports,0-1
28,04/01 16:06,-,Leverkusen (SALAYYY) EsportsvPorto (Chellovekk) Esports,2-1
29,04/01 16:06,-,Ajax (Inquisitor) EsportsvValencia (Olle) Esports,0-0
0,04/01 20:06,-,Inter (kalibra) EsportsvAtletico Madrid (Flewless_phoenix) Esports,1-1
