,Date,R,Casa v Visitante,-
20,04/11 13:06,-,Man United (vrico) EsportsvAjax (DangerDim77) Esports,1-2
21,04/11 12:54,-,Bayer Leverkusen (Foggy) EsportsvValencia (nikkitta) Esports,1-0
22,04/11 12:54,-,Ajax (DangerDim77) EsportsvPorto (Hrusch) Esports,2-2
23,04/11 12:42,-,Porto (Hrusch) EsportsvMan United (vrico) Esports,0-0
24,04/11 12:42,-,Valencia (nikkitta) EsportsvAjax (DangerDim77) Esports,1-0
25,04/11 12:30,-,Man United (vrico) EsportsvValencia (nikkitta) Esports,2-0
26,04/11 12:30,-,Ajax (DangerDim77) EsportsvBayer Leverkusen (Foggy) Esports,1-2
27,04/11 12:18,-,Man United (vrico) EsportsvBayer Leverkusen (Foggy) Esports,0-1
28,04/11 12:18,-,Porto (Hrusch) EsportsvValencia (nikkitta) Esports,0-0
29,04/11 12:06,-,Bayer Leverkusen (Foggy) EsportsvPorto (Hrusch) Esports,0-0
0,04/11 19:06,-,Man City (Kodak) EsportsvMan United (Boulevard_Prospect) Esports,1-1
1,04/11 18:54,-,Man United (Boulevard_Prospect) EsportsvTottenham (Skromnuy) Esports,1-1
2,04/11 18:54,-,Liverpool (KravaRK) EsportsvMan City (Kodak) Esports,2-4
3,04/11 18:42,-,Tottenham (Skromnuy) EsportsvLiverpool (KravaRK) Esports,3-0
4,04/11 18:42,-,Arsenal (Arcos) EsportsvMan United (Boulevard_Prospect) Esports,2-1
5,04/11 18:30,-,Man City (Kodak) EsportsvTottenham (Skromnuy) Esports,0-2
6,04/11 18:30,-,Liverpool (KravaRK) EsportsvArsenal (Arcos) Esports,0-2
7,04/11 17:48,-,Napoli (Kodak) EsportsvLazio (Arcos) Esports,0-3
8,04/11 17:48,-,AC Milan (KravaRK) EsportsvAtalanta (Boulevard_Prospect) Esports,1-1
9,04/11 17:36,-,Lazio (Arcos) EsportsvInter Milan (Skromnuy) Esports,2-0
10,04/11 17:36,-,Atalanta (Boulevard_Prospect) EsportsvNapoli (Kodak) Esports,2-2
11,04/11 17:24,-,Inter Milan (Skromnuy) EsportsvAtalanta (Boulevard_Prospect) Esports,0-1
12,04/11 17:24,-,Napoli (Kodak) EsportsvAC Milan (KravaRK) Esports,1-1
13,04/11 17:12,-,AC Milan (KravaRK) EsportsvInter Milan (Skromnuy) Esports,1-1
14,04/11 17:12,-,Atalanta (Boulevard_Prospect) EsportsvLazio (Arcos) Esports,1-1
15,04/11 17:00,-,Inter Milan (Skromnuy) EsportsvNapoli (Kodak) Esports,3-2
16,04/11 17:00,-,Lazio (Arcos) EsportsvAC Milan (KravaRK) Esports,0-2
17,04/11 16:48,-,Lazio (Arcos) EsportsvNapoli (Kodak) Esports,1-1
18,04/11 16:48,-,Atalanta (Boulevard_Prospect) EsportsvAC Milan (KravaRK) Esports,0-0
19,04/11 16:36,-,Napoli (Kodak) EsportsvAtalanta (Boulevard_Prospect) Esports,1-2
20,04/11 16:36,-,Inter Milan (Skromnuy) EsportsvLazio (Arcos) Esports,1-1
21,04/11 16:24,-,Atalanta (Boulevard_Prospect) EsportsvInter Milan (Skromnuy) Esports,2-0
22,04/11 16:24,-,AC Milan (KravaRK) EsportsvNapoli (Kodak) Esports,1-0
23,04/11 16:12,-,Inter Milan (Skromnuy) EsportsvAC Milan (KravaRK) Esports,0-0
24,04/11 16:12,-,Lazio (Arcos) EsportsvAtalanta (Boulevard_Prospect) Esports,2-2
25,04/11 16:00,-,AC Milan (KravaRK) EsportsvLazio (Arcos) Esports,2-1
26,04/11 16:00,-,Napoli (Kodak) EsportsvInter Milan (Skromnuy) Esports,0-3
27,04/11 15:48,-,Man City (KravaRK) EsportsvLiverpool (Boulevard_Prospect) Esports,1-0
28,04/11 15:48,-,Barcelona (Kodak) EsportsvPSG (Arcos) Esports,1-0
29,04/11 15:36,-,PSG (Arcos) EsportsvReal Madrid (Skromnuy) Esports,0-3
0,04/11 22:06,-,Portugal (Arcos) EsportsvEspanha (Skromnuy) Esports,1-0
1,04/11 21:54,-,Brasil (Kodak) EsportsvGermany (KravaRK) Esports,3-0
2,04/11 21:54,-,Espanha (Skromnuy) EsportsvBelgium (Boulevard_Prospect) Esports,0-1
3,04/11 21:42,-,Germany (KravaRK) EsportsvEspanha (Skromnuy) Esports,1-0
4,04/11 21:42,-,Belgium (Boulevard_Prospect) EsportsvPortugal (Arcos) Esports,1-0
5,04/11 21:30,-,Portugal (Arcos) EsportsvGermany (KravaRK) Esports,2-0
6,04/11 21:30,-,Espanha (Skromnuy) EsportsvBrasil (Kodak) Esports,1-2
7,04/11 21:18,-,Portugal (Arcos) EsportsvBrasil (Kodak) Esports,1-1
8,04/11 21:18,-,Belgium (Boulevard_Prospect) EsportsvGermany (KravaRK) Esports,1-1
9,04/11 21:06,-,Espanha (Skromnuy) EsportsvPortugal (Arcos) Esports,0-0
10,04/11 21:06,-,Brasil (Kodak) EsportsvBelgium (Boulevard_Prospect) Esports,1-0
11,04/11 20:54,-,Belgium (Boulevard_Prospect) EsportsvEspanha (Skromnuy) Esports,1-0
12,04/11 20:54,-,Germany (KravaRK) EsportsvBrasil (Kodak) Esports,2-0
13,04/11 20:42,-,Espanha (Skromnuy) EsportsvGermany (KravaRK) Esports,1-0
14,04/11 20:42,-,Portugal (Arcos) EsportsvBelgium (Boulevard_Prospect) Esports,2-1
15,04/11 20:30,-,Germany (KravaRK) EsportsvPortugal (Arcos) Esports,0-2
16,04/11 20:30,-,Brasil (Kodak) EsportsvEspanha (Skromnuy) Esports,1-2
17,04/11 20:18,-,Man City (Kodak) EsportsvArsenal (Arcos) Esports,0-3
18,04/11 20:18,-,Liverpool (KravaRK) EsportsvMan United (Boulevard_Prospect) Esports,0-0
19,04/11 20:06,-,Arsenal (Arcos) EsportsvTottenham (Skromnuy) Esports,0-4
20,04/11 20:06,-,Man United (Boulevard_Prospect) EsportsvMan City (Kodak) Esports,3-1
21,04/11 19:54,-,Man City (Kodak) EsportsvLiverpool (KravaRK) Esports,3-0
22,04/11 19:54,-,Tottenham (Skromnuy) EsportsvMan United (Boulevard_Prospect) Esports,2-1
23,04/11 19:42,-,Man United (Boulevard_Prospect) EsportsvArsenal (Arcos) Esports,0-0
24,04/11 19:42,-,Liverpool (KravaRK) EsportsvTottenham (Skromnuy) Esports,2-1
25,04/11 19:30,-,Tottenham (Skromnuy) EsportsvMan City (Kodak) Esports,2-0
26,04/11 19:30,-,Arsenal (Arcos) EsportsvLiverpool (KravaRK) Esports,2-1
27,04/11 19:18,-,Man United (Boulevard_Prospect) EsportsvLiverpool (KravaRK) Esports,3-1
28,04/11 19:18,-,Arsenal (Arcos) EsportsvMan City (Kodak) Esports,0-0
29,04/11 19:06,-,Tottenham (Skromnuy) EsportsvArsenal (Arcos) Esports,1-0
0,04/12 07:36,-,Bayern (LaikingDast) EsportsvPSG (vrico) Esports,2-2
1,04/12 07:24,-,Real Madrid (Hrusch) EsportsvBayern (LaikingDast) Esports,3-1
2,04/12 07:24,-,Napoli (PavlikJuravlik) EsportsvTottenham (Foggy) Esports,0-2
3,04/12 07:12,-,Bayern (LaikingDast) EsportsvNapoli (PavlikJuravlik) Esports,1-0
4,04/12 07:12,-,PSG (vrico) EsportsvReal Madrid (Hrusch) Esports,0-0
5,04/12 07:00,-,Tottenham (Foggy) EsportsvBayern (LaikingDast) Esports,2-0
6,04/12 07:00,-,Napoli (PavlikJuravlik) EsportsvPSG (vrico) Esports,1-1
7,04/12 06:48,-,Dynamo Kyiv (PavlikJuravlik)vShakhtar Donetsk (Hrusch) Esports,0-3
8,04/12 06:48,-,Spartak Moscow (Foggy) EsportsvLokomotiv Moscow (vrico) Esports,1-1
9,04/12 06:36,-,Lokomotiv Moscow (vrico) EsportsvCSKA Moscow (LaikingDast) Esports,0-0
10,04/12 06:36,-,Shakhtar Donetsk (Hrusch) EsportsvSpartak Moscow (Foggy) Esports,1-0
11,04/12 06:24,-,Spartak Moscow (Foggy) EsportsvDynamo Kyiv (PavlikJuravlik),2-0
12,04/12 06:24,-,CSKA Moscow (LaikingDast) EsportsvShakhtar Donetsk (Hrusch) Esports,0-2
13,04/12 06:12,-,Shakhtar Donetsk (Hrusch) EsportsvLokomotiv Moscow (vrico) Esports,2-1
14,04/12 06:12,-,Dynamo Kyiv (PavlikJuravlik)vCSKA Moscow (LaikingDast) Esports,2-1
15,04/12 06:00,-,CSKA Moscow (LaikingDast) EsportsvSpartak Moscow (Foggy) Esports,0-2
16,04/12 06:00,-,Lokomotiv Moscow (vrico) EsportsvDynamo Kyiv (PavlikJuravlik),1-0
17,04/12 05:48,-,Shakhtar Donetsk (Hrusch) EsportsvDynamo Kyiv (PavlikJuravlik),2-1
18,04/12 05:48,-,Lokomotiv Moscow (vrico) EsportsvSpartak Moscow (Foggy) Esports,0-2
19,04/12 05:36,-,Spartak Moscow (Foggy) EsportsvShakhtar Donetsk (Hrusch) Esports,1-1
20,04/12 05:36,-,CSKA Moscow (LaikingDast) EsportsvLokomotiv Moscow (vrico) Esports,1-1
21,04/12 05:24,-,Shakhtar Donetsk (Hrusch) EsportsvCSKA Moscow (LaikingDast) Esports,1-0
22,04/12 05:24,-,Dynamo Kyiv (PavlikJuravlik)vSpartak Moscow (Foggy) Esports,0-0
23,04/12 05:12,-,Lokomotiv Moscow (vrico) EsportsvShakhtar Donetsk (Hrusch) Esports,0-2
24,04/12 05:12,-,CSKA Moscow (LaikingDast) EsportsvDynamo Kyiv (PavlikJuravlik),2-1
25,04/12 05:00,-,Dynamo Kyiv (PavlikJuravlik)vLokomotiv Moscow (vrico) Esports,0-0
26,04/12 05:00,-,Spartak Moscow (Foggy) EsportsvCSKA Moscow (LaikingDast) Esports,1-0
27,04/11 22:18,-,Brasil (Kodak) EsportsvPortugal (Arcos) Esports,1-2
28,04/11 22:18,-,Germany (KravaRK) EsportsvBelgium (Boulevard_Prospect) Esports,0-1
29,04/11 22:06,-,Belgium (Boulevard_Prospect) EsportsvBrasil (Kodak) Esports,0-2
0,04/12 11:06,-,Germany (vrico) EsportsvPortugal (Laikingdast) Esports,1-0
1,04/12 10:54,-,Spain (Foggy) EsportsvBelgium (Pavlikjuravlik) Esports,2-0
2,04/12 10:54,-,Portugal (Laikingdast) EsportsvFrance (Hrusch) Esports,0-1
3,04/12 10:42,-,France (Hrusch) EsportsvGermany (vrico) Esports,1-0
4,04/12 10:42,-,Belgium (Pavlikjuravlik) EsportsvPortugal (Laikingdast) Esports,0-3
5,04/12 10:30,-,Germany (vrico) EsportsvBelgium (Pavlikjuravlik) Esports,0-0
6,04/12 10:30,-,Portugal (Laikingdast) EsportsvSpain (Foggy) Esports,1-1
7,04/12 10:18,-,Germany (vrico) EsportsvSpain (Foggy) Esports,0-2
8,04/12 10:18,-,France (Hrusch) EsportsvBelgium (Pavlikjuravlik) Esports,2-0
9,04/12 10:06,-,Portugal (Laikingdast) EsportsvGermany (vrico) Esports,2-0
10,04/12 10:06,-,Spain (Foggy) EsportsvFrance (Hrusch) Esports,1-2
11,04/12 09:54,-,France (Hrusch) EsportsvPortugal (Laikingdast) Esports,3-0
12,04/12 09:54,-,Belgium (Pavlikjuravlik) EsportsvSpain (Foggy) Esports,2-1
13,04/12 09:42,-,Portugal (Laikingdast) EsportsvBelgium (Pavlikjuravlik) Esports,0-0
14,04/12 09:42,-,Germany (vrico) EsportsvFrance (Hrusch) Esports,1-2
15,04/12 09:30,-,Spain (Foggy) EsportsvPortugal (Laikingdast) Esports,2-1
16,04/12 09:30,-,Belgium (Pavlikjuravlik) EsportsvGermany (vrico) Esports,0-0
17,04/12 08:48,-,Napoli (PavlikJuravlik) EsportsvReal Madrid (Hrusch) Esports,0-0
18,04/12 08:48,-,Tottenham (Foggy) EsportsvPSG (vrico) Esports,2-1
19,04/12 08:36,-,PSG (vrico) EsportsvBayern (LaikingDast) Esports,1-1
20,04/12 08:36,-,Real Madrid (Hrusch) EsportsvTottenham (Foggy) Esports,0-3
21,04/12 08:24,-,Bayern (LaikingDast) EsportsvReal Madrid (Hrusch) Esports,2-1
22,04/12 08:24,-,Tottenham (Foggy) EsportsvNapoli (PavlikJuravlik) Esports,1-1
23,04/12 08:12,-,Napoli (PavlikJuravlik) EsportsvBayern (LaikingDast) Esports,0-2
24,04/12 08:12,-,Real Madrid (Hrusch) EsportsvPSG (vrico) Esports,2-1
25,04/12 08:00,-,PSG (vrico) EsportsvNapoli (PavlikJuravlik) Esports,2-1
26,04/12 08:00,-,Bayern (LaikingDast) EsportsvTottenham (Foggy) Esports,0-1
27,04/12 07:48,-,Real Madrid (Hrusch) EsportsvNapoli (PavlikJuravlik) Esports,2-2
28,04/12 07:48,-,PSG (vrico) EsportsvTottenham (Foggy) Esports,0-2
29,04/12 07:36,-,Tottenham (Foggy) EsportsvReal Madrid (Hrusch) Esports,0-0
0,04/12 14:36,-,Man City (Skromnuy) EsportsvReal Madrid (Arcos) Esports,3-0
1,04/12 14:24,-,Barcelona (Jkey) EsportsvMan City (Skromnuy) Esports,1-1
2,04/12 14:24,-,PSG (KravaRK) EsportsvLiverpool (Kodak) Esports,0-1
3,04/12 14:12,-,Man City (Skromnuy) EsportsvPSG (KravaRK) Esports,1-0
4,04/12 14:12,-,Real Madrid (Arcos) EsportsvBarcelona (Jkey) Esports,1-1
5,04/12 14:00,-,PSG (KravaRK) EsportsvReal Madrid (Arcos) Esports,0-2
6,04/12 14:00,-,Liverpool (Kodak) EsportsvMan City (Skromnuy) Esports,0-3
7,04/12 13:18,-,Bayer Leverkusen (PavlikJuravlik) EsportsvValencia (Hrusch) Esports,0-0
8,04/12 13:18,-,Ajax (Foggy) EsportsvMan Utd (vrico) Esports,0-1
9,04/12 13:06,-,Man Utd (vrico) EsportsvPorto (LaikingDast) Esports,1-0
10,04/12 13:06,-,Valencia (Hrusch) EsportsvAjax (Foggy) Esports,2-1
11,04/12 12:54,-,Porto (LaikingDast) EsportsvValencia (Hrusch) Esports,0-1
12,04/12 12:54,-,Ajax (Foggy) EsportsvBayer Leverkusen (PavlikJuravlik) Esports,2-2
13,04/12 12:42,-,Valencia (Hrusch) EsportsvMan Utd (vrico) Esports,1-0
14,04/12 12:42,-,Bayer Leverkusen (PavlikJuravlik) EsportsvPorto (LaikingDast) Esports,4-1
15,04/12 12:30,-,Man Utd (vrico) EsportsvBayer Leverkusen (PavlikJuravlik) Esports,0-1
16,04/12 12:30,-,Porto (LaikingDast) EsportsvAjax (Foggy) Esports,3-2
17,04/12 12:18,-,Valencia (Hrusch) EsportsvBayer Leverkusen (PavlikJuravlik) Esports,0-0
18,04/12 12:18,-,Man Utd (vrico) EsportsvAjax (Foggy) Esports,0-0
19,04/12 12:06,-,Porto (LaikingDast) EsportsvMan Utd (vrico) Esports,0-3
20,04/12 12:06,-,Ajax (Foggy) EsportsvValencia (Hrusch) Esports,2-0
21,04/12 11:54,-,Valencia (Hrusch) EsportsvPorto (LaikingDast) Esports,1-3
22,04/12 11:54,-,Bayer Leverkusen (PavlikJuravlik) EsportsvAjax (Foggy) Esports,1-1
23,04/12 11:42,-,Man Utd (vrico) EsportsvValencia (Hrusch) Esports,0-1
24,04/12 11:42,-,Porto (LaikingDast) EsportsvBayer Leverkusen (PavlikJuravlik) Esports,1-1
25,04/12 11:30,-,Ajax (Foggy) EsportsvPorto (LaikingDast) Esports,0-1
26,04/12 11:30,-,Bayer Leverkusen (PavlikJuravlik) EsportsvMan Utd (vrico) Esports,1-2
27,04/12 11:18,-,Belgium (Pavlikjuravlik) EsportsvFrance (Hrusch) Esports,1-4
28,04/12 11:18,-,Spain (Foggy) EsportsvGermany (vrico) Esports,2-2
29,04/12 11:06,-,France (Hrusch) EsportsvSpain (Foggy) Esports,1-0
0,04/12 17:36,-,Atalanta (Arcos) EsportsvLazio (Skromnuy) Esports,1-4
1,04/12 17:24,-,AC Milan (Kodak) EsportsvInter Milan (KravaRK) Esports,1-2
2,04/12 17:24,-,Lazio (Skromnuy) EsportsvNapoli (Jkey) Esports,2-2
3,04/12 17:12,-,Napoli (Jkey) EsportsvAtalanta (Arcos) Esports,1-1
4,04/12 17:12,-,Inter Milan (KravaRK) EsportsvLazio (Skromnuy) Esports,0-3
5,04/12 17:00,-,Atalanta (Arcos) EsportsvInter Milan (KravaRK) Esports,2-0
6,04/12 17:00,-,Lazio (Skromnuy) EsportsvAC Milan (Kodak) Esports,2-0
7,04/12 16:48,-,Atalanta (Arcos) EsportsvAC Milan (Kodak) Esports,2-0
8,04/12 16:48,-,Napoli (Jkey) EsportsvInter Milan (KravaRK) Esports,0-1
9,04/12 16:36,-,Lazio (Skromnuy) EsportsvAtalanta (Arcos) Esports,2-0
10,04/12 16:36,-,AC Milan (Kodak) EsportsvNapoli (Jkey) Esports,0-1
11,04/12 16:24,-,Napoli (Jkey) EsportsvLazio (Skromnuy) Esports,0-4
12,04/12 16:24,-,Inter Milan (KravaRK) EsportsvAC Milan (Kodak) Esports,1-1
13,04/12 16:12,-,Lazio (Skromnuy) EsportsvInter Milan (KravaRK) Esports,1-1
14,04/12 16:12,-,Atalanta (Arcos) EsportsvNapoli (Jkey) Esports,2-2
15,04/12 16:00,-,Inter Milan (KravaRK) EsportsvAtalanta (Arcos) Esports,1-3
16,04/12 16:00,-,AC Milan (Kodak) EsportsvLazio (Skromnuy) Esports,1-1
17,04/12 15:48,-,Liverpool (Kodak) EsportsvReal Madrid (Arcos) Esports,4-5
18,04/12 15:48,-,PSG (KravaRK) EsportsvBarcelona (Jkey) Esports,1-3
19,04/12 15:36,-,Barcelona (Jkey) EsportsvLiverpool (Kodak) Esports,3-1
20,04/12 15:36,-,Real Madrid (Arcos) EsportsvMan City (Skromnuy) Esports,1-2
21,04/12 15:24,-,Man City (Skromnuy) EsportsvBarcelona (Jkey) Esports,1-0
22,04/12 15:24,-,Liverpool (Kodak) EsportsvPSG (KravaRK) Esports,4-2
23,04/12 15:12,-,PSG (KravaRK) EsportsvMan City (Skromnuy) Esports,3-0
24,04/12 15:12,-,Barcelona (Jkey) EsportsvReal Madrid (Arcos) Esports,0-3
25,04/12 15:00,-,Real Madrid (Arcos) EsportsvPSG (KravaRK) Esports,2-1
26,04/12 15:00,-,Man City (Skromnuy) EsportsvLiverpool (Kodak) Esports,3-1
27,04/12 14:48,-,Real Madrid (Arcos) EsportsvLiverpool (Kodak) Esports,1-1
28,04/12 14:48,-,Barcelona (Jkey) EsportsvPSG (KravaRK) Esports,2-2
29,04/12 14:36,-,Liverpool (Kodak) EsportsvBarcelona (Jkey) Esports,0-0
0,04/12 21:06,-,Portugal (Kodak) EsportsvBrazil (Jkey) Esports,3-0
1,04/12 20:54,-,Brazil (Jkey) EsportsvGermany (Skromnuy) Esports,0-0
2,04/12 20:54,-,Belgium (Kravark) EsportsvPortugal (Kodak) Esports,0-3
3,04/12 20:42,-,Spain (Arcos) EsportsvBrazil (Jkey) Esports,0-0
4,04/12 20:42,-,Germany (Skromnuy) EsportsvBelgium (Kravark) Esports,2-0
5,04/12 20:30,-,Portugal (Kodak) EsportsvGermany (Skromnuy) Esports,0-2
6,04/12 20:30,-,Belgium (Kravark) EsportsvSpain (Arcos) Esports,0-1
7,04/12 20:18,-,Liverpool (Kodak) EsportsvMan Utd (Arcos) Esports,0-1
8,04/12 20:18,-,Tottenham (KravaRK) EsportsvMan City (Jkey) Esports,1-0
9,04/12 20:06,-,Man Utd (Arcos) EsportsvArsenal (Skromnuy) Esports,0-0
10,04/12 20:06,-,Man City (Jkey) EsportsvLiverpool (Kodak) Esports,1-3
11,04/12 19:54,-,Liverpool (Kodak) EsportsvTottenham (KravaRK) Esports,2-2
12,04/12 19:54,-,Arsenal (Skromnuy) EsportsvMan City (Jkey) Esports,3-0
13,04/12 19:42,-,Tottenham (KravaRK) EsportsvArsenal (Skromnuy) Esports,0-2
14,04/12 19:42,-,Man City (Jkey) EsportsvMan Utd (Arcos) Esports,0-1
15,04/12 19:30,-,Arsenal (Skromnuy) EsportsvLiverpool (Kodak) Esports,0-1
16,04/12 19:30,-,Man Utd (Arcos) EsportsvTottenham (KravaRK) Esports,1-0
17,04/12 19:18,-,Man Utd (Arcos) EsportsvLiverpool (Kodak) Esports,2-0
18,04/12 19:18,-,Man City (Jkey) EsportsvTottenham (KravaRK) Esports,0-4
19,04/12 19:06,-,Arsenal (Skromnuy) EsportsvMan Utd (Arcos) Esports,1-1
20,04/12 19:06,-,Liverpool (Kodak) EsportsvMan City (Jkey) Esports,2-0
21,04/12 18:54,-,Man City (Jkey) EsportsvArsenal (Skromnuy) Esports,1-2
22,04/12 18:54,-,Tottenham (KravaRK) EsportsvLiverpool (Kodak) Esports,0-1
23,04/12 18:42,-,Man Utd (Arcos) EsportsvMan City (Jkey) Esports,3-1
24,04/12 18:42,-,Arsenal (Skromnuy) EsportsvTottenham (KravaRK) Esports,1-0
25,04/12 18:30,-,Tottenham (KravaRK) EsportsvMan Utd (Arcos) Esports,0-0
26,04/12 18:30,-,Liverpool (Kodak) EsportsvArsenal (Skromnuy) Esports,0-3
27,04/12 17:48,-,Inter Milan (KravaRK) EsportsvNapoli (Jkey) Esports,0-4
28,04/12 17:48,-,AC Milan (Kodak) EsportsvAtalanta (Arcos) Esports,1-3
29,04/12 17:36,-,Napoli (Jkey) EsportsvAC Milan (Kodak) Esports,1-2
0,04/13 05:54,-,CSKA Moscow (Boulevard_Prospect) EsportsvDynamo Kyiv (LaikingDast) Esports,2-1
1,04/13 05:48,-,Liverpool (Hrusch) EsportsvReal Madrid (DangerDim77) Esports,1-0
2,04/13 05:48,-,Barcelona (vrico) EsportsvPSG (orlovsky1) Esports,0-2
3,04/13 05:42,-,Spartak Moscow (Mr.Jab) EsportsvCSKA Moscow (Boulevard_Prospect) Esports,1-1
4,04/13 05:42,-,Dynamo Kyiv (LaikingDast) EsportsvShakhtar Donetsk (d1pseN) Esports,1-0
5,04/13 05:40,-,Spartak Moscow (Mr.Jab) EsportsvCSKA (Boulevard_Prospect) Esports,1-1
6,04/13 05:36,-,Real Madrid (DangerDim77) EsportsvBarcelona (vrico) Esports,0-0
7,04/13 05:36,-,Man City (nikkitta) EsportsvLiverpool (Hrusch) Esports,2-0
8,04/13 05:30,-,Shakhtar Donetsk (d1pseN) EsportsvSpartak Moscow (Mr.Jab) Esports,0-2
9,04/13 05:30,-,Loko Moscow (Bombi1t0) EsportsvDynamo Kyiv (LaikingDast) Esports,1-0
10,04/13 05:24,-,Barcelona (vrico) EsportsvMan City (nikkitta) Esports,1-1
11,04/13 05:24,-,PSG (orlovsky1) EsportsvReal Madrid (DangerDim77) Esports,2-0
12,04/13 05:22,-,Barcelona (vrico) EsportsvPSG (orlovsky1) Esports,0-2
13,04/13 05:12,-,Man City (nikkitta) EsportsvPSG (orlovsky1) Esports,0-4
14,04/13 05:12,-,Liverpool (Hrusch) EsportsvBarcelona (vrico) Esports,1-1
15,04/13 05:00,-,Real Madrid (DangerDim77) EsportsvMan City (nikkitta) Esports,0-1
16,04/13 05:00,-,PSG (orlovsky1) EsportsvLiverpool (Hrusch) Esports,1-3
17,04/12 22:18,-,Belgium (Kravark) EsportsvBrazil (Jkey) Esports,4-0
18,04/12 22:18,-,Portugal (Kodak) EsportsvSpain (Arcos) Esports,0-1
19,04/12 22:06,-,Brazil (Jkey) EsportsvPortugal (Kodak) Esports,1-0
20,04/12 22:06,-,Spain (Arcos) EsportsvGermany (Skromnuy) Esports,0-1
21,04/12 21:54,-,Portugal (Kodak) EsportsvBelgium (Kravark) Esports,1-3
22,04/12 21:54,-,Germany (Skromnuy) EsportsvBrazil (Jkey) Esports,1-0
23,04/12 21:42,-,Brazil (Jkey) EsportsvSpain (Arcos) Esports,1-5
24,04/12 21:42,-,Belgium (Kravark) EsportsvGermany (Skromnuy) Esports,0-2
25,04/12 21:30,-,Spain (Arcos) EsportsvBelgium (Kravark) Esports,0-3
26,04/12 21:30,-,Germany (Skromnuy) EsportsvPortugal (Kodak) Esports,2-0
27,04/12 21:18,-,Spain (Arcos) EsportsvPortugal (Kodak) Esports,1-1
28,04/12 21:18,-,Brazil (Jkey) EsportsvBelgium (Kravark) Esports,1-1
29,04/12 21:06,-,Germany (Skromnuy) EsportsvSpain (Arcos) Esports,1-1
0,04/13 07:00,-,Man United (orlovsky1) EsportsvTottenham (Hrusch) Esports,2-1
1,04/13 06:54,-,Man City (vrico) EsportsvTottenham (Hrusch) Esports,0-0
2,04/13 06:54,-,Tottenham (Hrusch) EsportsvMan City (vrico) Esports,0-0
3,04/13 06:54,-,Dynamo Kyiv (LaikingDast) EsportsvCSKA (Boulevard_Prospect) Esports,1-1
4,04/13 06:54,-,Loko Moscow (Bombi1t0) EsportsvShakhtar Donetsk (d1pseN) Esports,1-1
5,04/13 06:54,-,Dynamo Kyiv (LaikingDast) EsportsvCSKA Moscow (Boulevard_Prospect) Esports,1-1
6,04/13 06:48,-,Real Madrid (DangerDim77) EsportsvLiverpool (Hrusch) Esports,2-1
7,04/13 06:48,-,PSG (orlovsky1) EsportsvBarcelona (vrico) Esports,1-1
8,04/13 06:42,-,CSKA (Boulevard_Prospect) EsportsvSpartak Moscow (Mr.Jab) Esports,0-0
9,04/13 06:42,-,Shakhtar Donetsk (d1pseN) EsportsvDynamo Kyiv (LaikingDast) Esports,0-0
10,04/13 06:42,-,CSKA Moscow (Boulevard_Prospect) EsportsvSpartak Moscow (Mr.Jab) Esports,0-0
11,04/13 06:36,-,Liverpool (Hrusch) EsportsvMan City (DangerDim77) Esports,1-1
12,04/13 06:36,-,Barcelona (vrico) EsportsvReal Madrid (DangerDim77) Esports,1-1
13,04/13 06:36,-,Liverpool (Hrusch) EsportsvMan City (nikkitta) Esports,1-1
14,04/13 06:30,-,Spartak Moscow (Mr.Jab) EsportsvShakhtar Donetsk (d1pseN) Esports,3-1
15,04/13 06:30,-,Dynamo Kyiv (LaikingDast) EsportsvLoko Moscow (Bombi1t0) Esports,0-1
16,04/13 06:24,-,Man City (nikkitta) EsportsvBarcelona (vrico) Esports,2-1
17,04/13 06:24,-,Real Madrid (DangerDim77) EsportsvPSG (orlovsky1) Esports,1-3
18,04/13 06:18,-,CSKA (Boulevard_Prospect) EsportsvShakhtar Donetsk (d1pseN) Esports,0-0
19,04/13 06:18,-,Spartak Moscow (Mr.Jab) EsportsvLoko Moscow (Bombi1t0) Esports,1-0
20,04/13 06:18,-,CSKA Moscow (Boulevard_Prospect) EsportsvShakhtar Donetsk (d1pseN) Esports,0-0
21,04/13 06:12,-,PSG (orlovsky1) EsportsvMan City (nikkitta) Esports,3-2
22,04/13 06:12,-,Barcelona (vrico) EsportsvLiverpool (Hrusch) Esports,1-1
23,04/13 06:06,-,Loko Moscow (Bombi1t0) EsportsvCSKA (Boulevard_Prospect) Esports,0-0
24,04/13 06:06,-,Dynamo Kyiv (LaikingDast) EsportsvSpartak Moscow (Mr.Jab) Esports,1-1
25,04/13 06:06,-,Loko Moscow (Bombi1t0) EsportsvCSKA Moscow (Boulevard_Prospect) Esports,0-0
26,04/13 06:00,-,Liverpool (Hrusch) EsportsvPSG (orlovsky1) Esports,1-1
27,04/13 06:00,-,Man City (nikkitta) EsportsvReal Madrid (DangerDim77) Esports,0-1
28,04/13 05:54,-,CSKA (Boulevard_Prospect) EsportsvDynamo Kyiv (LaikingDast) Esports,2-1
29,04/13 05:54,-,Shakhtar Donetsk (d1pseN) EsportsvLoko Moscow (Bombi1t0) Esports,0-2
0,04/13 08:24,-,Liverpool (DangerDim77) EsportsvMan United (orlovsky1) Esports,3-0
1,04/13 08:18,-,M'Gladbach (Boulevard_Prospect) EsportsvBayern (d1pseN) Esports,2-0
2,04/13 08:18,-,Leverkusen (Mr.Jab) EsportsvDortmund (Bombi1t0) Esports,0-2
3,04/13 08:12,-,Man City (vrico) EsportsvTottenham (Hrusch) Esports,0-0
4,04/13 08:12,-,Man United (orlovsky1) EsportsvArsenal (nikkitta) Esports,3-0
5,04/13 08:06,-,RB Leipzig (LaikingDast) EsportsvLeverkusen (Mr.Jab) Esports,0-2
6,04/13 08:06,-,Dortmund (Bombi1t0) EsportsvM'Gladbach (Boulevard_Prospect) Esports,1-1
7,04/13 08:00,-,Arsenal (nikkitta) EsportsvLiverpool (DangerDim77) Esports,0-0
8,04/13 08:00,-,Tottenham (Hrusch) EsportsvMan United (orlovsky1) Esports,1-1
9,04/13 07:54,-,Bayern (d1pseN) EsportsvDortmund (Bombi1t0) Esports,1-1
10,04/13 07:54,-,M'Gladbach (Boulevard_Prospect) EsportsvRB Leipzig (LaikingDast) Esports,2-2
11,04/13 07:48,-,Man City (vrico) EsportsvMan Utd (orlovsky1) Esports,3-3
12,04/13 07:48,-,Tottenham (Hrusch) EsportsvLiverpool (DangerDim77) Esports,0-0
13,04/13 07:42,-,Leverkusen (Mr.Jab) EsportsvM'Gladbach (Boulevard_Prospect) Esports,1-1
14,04/13 07:42,-,RB Leipzig (LaikingDast) EsportsvBayern (d1pseN) Esports,1-0
15,04/13 07:36,-,Arsenal (nikkitta) EsportsvTottenham (Hrusch) Esports,0-0
16,04/13 07:36,-,Liverpool (DangerDim77) EsportsvMan City (vrico) Esports,0-2
17,04/13 07:30,-,Dortmund (Bombi1t0) EsportsvRB Leipzig (LaikingDast) Esports,2-0
18,04/13 07:30,-,Bayern (d1pseN) EsportsvLeverkusen (Mr.Jab) Esports,2-5
19,04/13 07:24,-,Man United (orlovsky1) EsportsvLiverpool (DangerDim77) Esports,2-2
20,04/13 07:24,-,Man City (vrico) EsportsvArsenal (nikkitta) Esports,1-1
21,04/13 07:18,-,Shakhtar Donetsk (d1pseN) EsportsvCSKA (Boulevard_Prospect) Esports,1-2
22,04/13 07:18,-,Loko Moscow (Bombi1t0) EsportsvSpartak Moscow (Mr.Jab) Esports,2-1
23,04/13 07:18,-,Shakhtar Donetsk (d1pseN) EsportsvCSKA Moscow (Boulevard_Prospect) Esports,1-2
24,04/13 07:12,-,Tottenham (Hrusch) EsportsvMan City (vrico) Esports,0-0
25,04/13 07:12,-,Arsenal (nikkitta) EsportsvMan United (orlovsky1) Esports,0-0
26,04/13 07:06,-,CSKA (Boulevard_Prospect) EsportsvLoko Moscow (Bombi1t0) Esports,0-0
27,04/13 07:06,-,Spartak Moscow (Mr.Jab) EsportsvDynamo Kyiv (LaikingDast) Esports,0-1
28,04/13 07:06,-,CSKA Moscow (Boulevard_Prospect) EsportsvLoko Moscow (Bombi1t0) Esports,0-0
29,04/13 07:00,-,Liverpool (DangerDim77) EsportsvArsenal (nikkitta) Esports,0-0
0,04/13 10:24,-,Man City (white_boy1927) EsportsvArsenal (mooneycb) Esports,1-0
1,04/13 10:18,-,Real Madrid (vrico) EsportsvNapoli (orlovsky1) Esports,2-0
2,04/13 10:18,-,PSG (Hrusch) EsportsvBayern (DangerDim77) Esports,3-2
3,04/13 10:12,-,Man Utd (Inquisitor) EsportsvMan City (white_boy1927) Esports,0-2
4,04/13 10:12,-,Arsenal (mooneycb) EsportsvLiverpool (Foggy) Esports,0-1
5,04/13 10:06,-,Tottenham (nikkitta) EsportsvPSG (Hrusch) Esports,3-1
6,04/13 10:06,-,Bayern (DangerDim77) EsportsvReal Madrid (vrico) Esports,1-1
7,04/13 10:00,-,Tottenham (Olle) EsportsvArsenal (mooneycb) Esports,0-0
8,04/13 10:00,-,Liverpool (Foggy) EsportsvMan Utd (Inquisitor) Esports,2-0
9,04/13 09:54,-,Real Madrid (vrico) EsportsvTottenham (nikkitta) Esports,0-0
10,04/13 09:54,-,Napoli (orlovsky1) EsportsvBayern (DangerDim77) Esports,1-0
11,04/13 09:42,-,Tottenham (nikkitta) EsportsvNapoli (orlovsky1) Esports,1-1
12,04/13 09:42,-,PSG (Hrusch) EsportsvReal Madrid (vrico) Esports,1-1
13,04/13 09:30,-,Napoli (orlovsky1) EsportsvPSG (Hrusch) Esports,4-1
14,04/13 09:30,-,Bayern (DangerDim77) EsportsvTottenham (nikkitta) Esports,0-0
15,04/13 09:18,-,Bayern (d1pseN) EsportsvM'Gladbach (Boulevard_Prospect) Esports,1-1
16,04/13 09:18,-,Dortmund (Bombi1t0) EsportsvLeverkusen (Mr.Jab) Esports,2-2
17,04/13 09:06,-,Leverkusen (Mr.Jab) EsportsvRB Leipzig (LaikingDast) Esports,1-0
18,04/13 09:06,-,M'Gladbach (Boulevard_Prospect) EsportsvDortmund (Bombi1t0) Esports,2-1
19,04/13 08:54,-,Dortmund (Bombi1t0) EsportsvBayern (d1pseN) Esports,1-1
20,04/13 08:54,-,RB Leipzig (LaikingDast) EsportsvM'Gladbach (Boulevard_Prospect) Esports,1-0
21,04/13 08:48,-,Liverpool (DangerDim77) EsportsvTottenham (Hrusch) Esports,1-0
22,04/13 08:48,-,Man Utd (orlovsky1) EsportsvMan City (vrico) Esports,1-0
23,04/13 08:42,-,Bayern (d1pseN) EsportsvRB Leipzig (LaikingDast) Esports,2-0
24,04/13 08:42,-,M'Gladbach (Boulevard_Prospect) EsportsvLeverkusen (Mr.Jab) Esports,3-1
25,04/13 08:36,-,Tottenham (Hrusch) EsportsvArsenal (nikkitta) Esports,0-3
26,04/13 08:36,-,Man City (vrico) EsportsvLiverpool (DangerDim77) Esports,1-1
