,Date,R,Casa v Visitante,-
0,03/24 16:48,-,PSG (FEARGGWP) EsportsvNapoli (Kalibra) Esports,0-2
1,03/24 16:42,-,Leverkusen (BlackStar98) EsportsvAjax (mooneycb) Esports,0-1
2,03/24 16:42,-,Man United (Pablik) EsportsvPorto (Inquisitor) Esports,0-0
3,03/24 16:36,-,Bayern (PASHOK75) EsportsvPSG (FEARGGWP) Esports,0-3
4,03/24 16:36,-,Napoli (Kalibra) EsportsvTottenham (Flewless_phoenix) Esports,1-1
5,03/24 16:30,-,Ajax (mooneycb) EsportsvValencia (Chellovekk) Esports,1-1
6,03/24 16:28,-,Porto (Inquisitor) EsportsvLeverkusen (BlackStar98) Esports,0-0
7,03/24 16:24,-,Tottenham (Flewless_phoenix) EsportsvBayern (PASHOK75) Esports,1-1
8,03/24 16:24,-,PSG (FEARGGWP) EsportsvReal Madrid (taka) Esports,0-1
9,03/24 16:18,-,Man United (Pablik) EsportsvLeverkusen (BlackStar98) Esports,0-0
10,03/24 16:18,-,Porto (Inquisitor) EsportsvValencia (Chellovekk) Esports,0-1
11,03/24 16:12,-,Bayern (PASHOK75) EsportsvNapoli (Kalibra) Esports,3-2
12,03/24 16:11,-,Valencia (Chellovekk) EsportsvMan United (Pablik) Esports,0-2
13,03/24 16:06,-,Ajax (mooneycb) EsportsvPorto (Inquisitor) Esports,1-1
14,03/24 16:00,-,Napoli (Kalibra) EsportsvReal Madrid (taka) Esports,1-2
15,03/24 16:00,-,Tottenham (Flewless_phoenix) EsportsvPSG (FEARGGWP) Esports,1-1
16,03/24 15:54,-,Leverkusen (BlackStar98) EsportsvValencia (Chellovekk) Esports,1-2
17,03/24 15:54,-,Man United (Pablik) EsportsvAjax (mooneycb) Esports,1-1
18,03/24 15:48,-,Bayern (PASHOK75) EsportsvReal Madrid (taka) Esports,0-2
19,03/24 15:48,-,Napoli (Kalibra) EsportsvPSG (FEARGGWP) Esports,0-1
20,03/24 15:42,-,Porto (Inquisitor) EsportsvMan United (Pablik) Esports,0-0
21,03/24 15:42,-,Ajax (mooneycb) EsportsvLeverkusen (BlackStar98) Esports,1-2
22,03/24 15:36,-,PSG (FEARGGWP) EsportsvBayern (PASHOK75) Esports,3-1
23,03/24 15:36,-,Tottenham (Flewless_phoenix) EsportsvNapoli (Kalibra) Esports,3-0
24,03/24 15:30,-,Leverkusen (BlackStar98) EsportsvPorto (Inquisitor) Esports,0-2
25,03/24 15:30,-,Valencia (Chellovekk) EsportsvAjax (mooneycb) Esports,1-1
26,03/24 15:24,-,Bayern (PASHOK75) EsportsvTottenham (Flewless_phoenix) Esports,1-1
27,03/24 15:24,-,Real Madrid (taka) EsportsvPSG (FEARGGWP) Esports,0-1
28,03/24 15:10,-,Real Madrid (taka) EsportsvTottenham (Flewless_phoenix) Esports,1-0
29,03/24 15:05,-,Napoli (Kalibra) EsportsvBayern (PASHOK75) Esports,0-0
0,03/24 18:18,-,PSG (Pablik) EsportsvLiverpool (BlackStar98) Esports,1-2
1,03/24 18:18,-,Barcelona (Inquisitor) EsportsvReal Madrid (Chellovekk) Esports,2-2
2,03/24 18:12,-,Liverpool (taka) EsportsvMan City (Flewless_phoenix) Esports,0-0
3,03/24 18:06,-,Real Madrid (Chellovekk) EsportsvPSG (Pablik) Esports,4-2
4,03/24 18:05,-,Barcelona (Inquisitor) EsportsvMan City (mooneycb) Esports,0-1
5,03/24 18:00,-,Tottenham (kalibra) EsportsvLiverpool (taka) Esports,1-1
6,03/24 18:00,-,Man City (Flewless_phoenix) EsportsvArsenal (FEARGGWP) Esports,0-0
7,03/24 17:54,-,PSG (Pablik) EsportsvMan City (mooneycb) Esports,0-0
8,03/24 17:54,-,Liverpool (BlackStar98) EsportsvReal Madrid (Chellovekk) Esports,2-1
9,03/24 17:48,-,Tottenham (kalibra) EsportsvArsenal (FEARGGWP) Esports,2-2
10,03/24 17:48,-,Man United (PASHOK75) EsportsvLiverpool (taka) Esports,1-1
11,03/24 17:44,-,PSG (Pablik) EsportsvBarcelona (Inquisitor) Esports,2-1
12,03/24 17:42,-,Man United (PASHOK75) EsportsvArsenal (FEARGGWP) Esports,1-2
13,03/24 17:42,-,Man City (mooneycb) EsportsvBarcelona (Inquisitor) Esports,1-1
14,03/24 17:42,-,Man City (mooneycb) EsportsvLiverpool (BlackStar98) Esports,1-0
15,03/24 17:36,-,Man City (Flewless_phoenix) EsportsvTottenham (kalibra) Esports,2-3
16,03/24 17:32,-,Real Madrid (Chellovekk) EsportsvMan City (mooneycb) Esports,1-1
17,03/24 17:30,-,Liverpool (BlackStar98) EsportsvBarcelona (Inquisitor) Esports,1-0
18,03/24 17:24,-,Man United (PASHOK75) EsportsvMan City (Flewless_phoenix) Esports,0-4
19,03/24 17:20,-,Arsenal (FEARGGWP) EsportsvLiverpool (taka) Esports,5-0
20,03/24 17:19,-,Man United (PASHOK75) EsportsvTottenham (kalibra) Esports,1-1
21,03/24 17:18,-,Valencia (Chellovekk) EsportsvPorto (Inquisitor) Esports,1-1
22,03/24 17:18,-,Leverkusen (BlackStar98) EsportsvMan United (Pablik) Esports,0-2
23,03/24 17:12,-,Man City (Flewless_phoenix) EsportsvLiverpool (taka) Esports,1-1
24,03/24 17:06,-,Man United (Pablik) EsportsvValencia (Chellovekk) Esports,1-3
25,03/24 17:06,-,Porto (Inquisitor) EsportsvAjax (mooneycb) Esports,0-0
26,03/24 16:54,-,Ajax (mooneycb) EsportsvMan United (Pablik) Esports,0-0
27,03/24 16:54,-,Valencia (Chellovekk) EsportsvLeverkusen (BlackStar98) Esports,1-0
28,03/24 16:50,-,Liverpool (taka) EsportsvTottenham (kalibra) Esports,2-1
29,03/24 16:48,-,Real Madrid (taka) EsportsvBayern (PASHOK75) Esports,1-1
0,03/24 21:15,-,France (TAKA) EsportsvSpain (kalibra) Esports,1-1
1,03/24 21:15,-,Spain (kalibra) EsportsvGermany (PASHOK75) Esports,1-0
2,03/24 21:06,-,Chelsea (PASHOK75) EsportsvAjax (FEARGGWP) Esports,2-2
3,03/24 21:06,-,Atletico Madrid (kalibra) EsportsvInter (Flewless_phoenix) Esports,0-1
4,03/24 20:54,-,Inter (Flewless_phoenix) EsportsvChelsea (PASHOK75) Esports,1-0
5,03/24 20:54,-,Ajax (FEARGGWP) EsportsvDortmund (taka) Esports,1-2
6,03/24 20:42,-,Chelsea (PASHOK75) EsportsvAtletico Madrid (kalibra) Esports,2-1
7,03/24 20:42,-,Dortmund (taka) EsportsvInter (Flewless_phoenix) Esports,1-0
8,03/24 20:18,-,Atletico Madrid (kalibra) EsportsvAjax (FEARGGWP) Esports,3-1
9,03/24 20:18,-,Chelsea (PASHOK75) EsportsvDortmund (taka) Esports,1-4
10,03/24 20:06,-,Inter (Flewless_phoenix) EsportsvAtletico Madrid (kalibra) Esports,0-1
11,03/24 20:06,-,Ajax (FEARGGWP) EsportsvChelsea (PASHOK75) Esports,0-2
12,03/24 19:54,-,Chelsea (PASHOK75) EsportsvInter (Flewless_phoenix) Esports,0-0
13,03/24 19:54,-,Dortmund (taka) EsportsvAjax (FEARGGWP) Esports,0-2
14,03/24 19:42,-,Inter (Flewless_phoenix) EsportsvDortmund (taka) Esports,1-1
15,03/24 19:42,-,Atletico Madrid (kalibra) EsportsvChelsea (PASHOK75) Esports,0-0
16,03/24 19:32,-,Inter (Flewless_phoenix) EsportsvAjax (FEARGGWP) Esports,1-1
17,03/24 19:32,-,Atletico Madrid (kalibra) EsportsvDortmund (taka) Esports,1-2
18,03/24 19:18,-,Real Madrid (Chellovekk) EsportsvBarcelona (Inquisitor) Esports,3-3
19,03/24 19:18,-,Liverpool (BlackStar98) EsportsvPSG (Pablik) Esports,1-4
20,03/24 19:06,-,PSG (Pablik) EsportsvReal Madrid (Chellovekk) Esports,0-2
21,03/24 18:54,-,Man City (mooneycb) EsportsvPSG (Pablik) Esports,3-0
22,03/24 18:54,-,Real Madrid (Chellovekk) EsportsvLiverpool (BlackStar98) Esports,2-6
23,03/24 18:48,-,Arsenal (FEARGGWP) EsportsvTottenham (kalibra) Esports,1-2
24,03/24 18:48,-,Liverpool (taka) EsportsvMan United (PASHOK75) Esports,3-1
25,03/24 18:42,-,Liverpool (BlackStar98) EsportsvMan City (mooneycb) Esports,0-0
26,03/24 18:36,-,Tottenham (kalibra) EsportsvMan City (Flewless_phoenix) Esports,1-1
27,03/24 18:30,-,Barcelona (Inquisitor) EsportsvLiverpool (BlackStar98) Esports,2-1
28,03/24 18:30,-,Man City (mooneycb) EsportsvReal Madrid (Chellovekk) Esports,0-3
29,03/24 18:24,-,Man City (Flewless_phoenix) EsportsvMan United (PASHOK75) Esports,3-1
0,03/24 23:54,-,Bayern (Kray) EsportsvReal Madrid (Upcake22) Esports,1-3
1,03/24 23:40,-,Real Madrid (Upcake22) EsportsvTottenham (MeLToSiK) Esports,0-2
2,03/24 23:18,-,Man Utd (KraftVK) EsportsvArsenal (labotryas) Esports,1-2
3,03/24 23:18,-,Portugal (FEARGGWP) EsportsvSpain (kalibra) Esports,0-0
4,03/24 23:18,-,France (TAKA) EsportsvGermany (PASHOK75) Esports,0-0
5,03/24 23:06,-,Man City (Kray) EsportsvMan Utd (KraftVK) Esports,1-2
6,03/24 23:06,-,Germany (PASHOK75) EsportsvPortugal (FEARGGWP) Esports,0-0
7,03/24 22:54,-,Tottenham (Upcake22) EsportsvMan City (Kray) Esports,0-0
8,03/24 22:54,-,Belgium (Flewless_phoenix) EsportsvGermany (PASHOK75) Esports,1-1
9,03/24 22:54,-,Portugal (FEARGGWP) EsportsvFrance (TAKA) Esports,3-0
10,03/24 22:42,-,Liverpool (Meltosik) EsportsvTottenham (Upcake22) Esports,0-0
11,03/24 22:30,-,Arsenal (labotryas) EsportsvLiverpool (Meltosik) Esports,1-1
12,03/24 22:30,-,Belgium (Flewless_phoenix) EsportsvPortugal (FEARGGWP) Esports,0-0
13,03/24 22:18,-,Arsenal (labotryas) EsportsvMan Utd (KraftVK) Esports,0-1
14,03/24 22:18,-,Spain (kalibra) EsportsvPortugal (FEARGGWP) Esports,0-0
15,03/24 22:18,-,Germany (PASHOK75) EsportsvFrance (TAKA) Esports,1-1
16,03/24 22:06,-,Man Utd (KraftVK) EsportsvMan City (Kray) Esports,1-0
17,03/24 22:06,-,Portugal (FEARGGWP) EsportsvGermany (PASHOK75) Esports,0-2
18,03/24 22:03,-,Spain (kalibra) EsportsvBelgium (Flewless_phoenix) Esports,1-0
19,03/24 21:54,-,France (TAKA) EsportsvPortugal (FEARGGWP) Esports,2-3
20,03/24 21:54,-,Germany (PASHOK75) EsportsvBelgium (Flewless_phoenix) Esports,0-3
21,03/24 21:47,-,Man City (Kray) EsportsvTottenham (Upcake22) Esports,0-0
22,03/24 21:41,-,Germany (PASHOK75) EsportsvSpain (kalibra) Esports,2-3
23,03/24 21:37,-,France (TAKA) EsportsvBelgium (Flewless_phoenix) Esports,2-2
24,03/24 21:36,-,Spain (kalibra) EsportsvFrance (TAKA) Esports,1-1
25,03/24 21:31,-,Belgium (Flewless_phoenix) EsportsvSpain (kalibra) Esports,2-0
26,03/24 21:30,-,Portugal (FEARGGWP) EsportsvBelgium (Flewless_phoenix) Esports,1-0
27,03/24 21:18,-,Dortmund (taka) EsportsvChelsea (PASHOK75) Esports,2-2
28,03/24 21:18,-,Ajax (FEARGGWP) EsportsvAtletico Madrid (kalibra) Esports,1-1
29,03/24 21:15,-,Belgium (Flewless_phoenix) EsportsvFrance (TAKA) Esports,1-1
0,03/25 03:36,-,Atletico Madrid (labotryas) EsportsvInter (Upcake22) Esports,0-0
1,03/25 03:24,-,Inter (Upcake22) EsportsvAjax (Kray) Esports,1-0
2,03/25 03:24,-,Chelsea (KRaftVK) EsportsvDortmund (MeLToSiK) Esports,0-1
3,03/25 03:12,-,Dortmund (MeLToSiK) EsportsvInter (Upcake22) Esports,0-0
4,03/25 03:12,-,Ajax (Kray) EsportsvAtletico Madrid (labotryas) Esports,1-3
5,03/25 03:00,-,Inter (Upcake22) EsportsvChelsea (KRaftVK) Esports,0-0
6,03/25 03:00,-,Atletico Madrid (labotryas) EsportsvDortmund (MeLToSiK) Esports,2-0
7,03/25 02:48,-,Atletico Madrid (labotryas) EsportsvChelsea (KRaftVK) Esports,1-1
8,03/25 02:47,-,Dortmund (MeLToSiK) EsportsvAjax (Kray) Esports,0-0
9,03/25 02:36,-,Inter (Upcake22) EsportsvAtletico Madrid (labotryas) Esports,1-0
10,03/25 02:36,-,Chelsea (KRaftVK) EsportsvAjax (Kray) Esports,0-2
11,03/25 02:24,-,Ajax (Kray) EsportsvInter (Upcake22) Esports,0-0
12,03/25 02:24,-,Dortmund (MeLToSiK) EsportsvChelsea (KRaftVK) Esports,0-0
13,03/25 02:12,-,Inter (Upcake22) EsportsvDortmund (MeLToSiK) Esports,0-0
14,03/25 02:08,-,Ajax (Kray) EsportsvDortmund (MeLToSiK) Esports,0-0
15,03/25 02:08,-,Atletico Madrid (labotryas) EsportsvAjax (Kray) Esports,0-0
16,03/25 02:00,-,Chelsea (KRaftVK) EsportsvInter (Upcake22) Esports,0-0
17,03/25 01:54,-,Dortmund (MeLToSiK) EsportsvAtletico Madrid (labotryas) Esports,0-0
18,03/25 01:18,-,Tottenham (MeLToSiK) EsportsvBayern (Kray) Esports,2-2
19,03/25 01:07,-,Bayern (Kray) EsportsvPSG (KRaftVK) Esports,0-0
20,03/25 00:55,-,Real Madrid (Upcake22) EsportsvBayern (Kray) Esports,0-0
21,03/25 00:42,-,Tottenham (MeLToSiK) EsportsvReal Madrid (Upcake22) Esports,1-2
22,03/25 00:30,-,Napoli (labotryas) EsportsvTottenham (MeLToSiK) Esports,2-2
23,03/25 00:30,-,Real Madrid (Upcake22) EsportsvPSG (KRaftVK) Esports,1-1
24,03/25 00:18,-,Bayern (Kray) EsportsvTottenham (MeLToSiK) Esports,2-2
25,03/25 00:14,-,PSG (KRaftVK) EsportsvNapoli (labotryas) Esports,2-1
26,03/25 00:06,-,PSG (KRaftVK) EsportsvBayern (Kray) Esports,0-1
27,03/25 00:04,-,Napoli (labotryas) EsportsvReal Madrid (Upcake22) Esports,1-1
28,03/25 00:04,-,PSG (KRaftVK) EsportsvTottenham (MeLToSiK) Esports,0-0
29,03/24 23:55,-,Bayern (Kray) EsportsvNapoli (labotryas) Esports,0-1
0,03/25 06:36,-,Real Madrid (dm1trena) EsportsvBarcelona (DangerDim77) Esports,1-0
1,03/25 06:36,-,ManCity (orlovsky1) EsportsvPSG (slezaintima) Esports,2-2
2,03/25 06:30,-,Dynamo Kyiv (vrico) EsportsvLokomotiv Moscow (LaikingDast) Esports,0-0
3,03/25 06:24,-,PSG (slezaintima) EsportsvReal Madrid (dm1trena) Esports,0-0
4,03/25 06:24,-,Liverpool (nikkitta) EsportsvManCity (orlovsky1) Esports,2-1
5,03/25 06:12,-,Real Madrid (dm1trena) EsportsvLiverpool (nikkitta) Esports,3-2
6,03/25 06:08,-,Barcelona (DangerDim77) EsportsvPSG (slezaintima) Esports,3-0
7,03/25 06:00,-,ManCity (orlovsky1) EsportsvReal Madrid (dm1trena) Esports,0-1
8,03/25 05:48,-,Belgium (KRaftVK) EsportsvSpain (labotryas) Esports,0-0
9,03/25 05:47,-,Liverpool (nikkitta) EsportsvBarcelona (DangerDim77) Esports,2-1
10,03/25 05:36,-,France (Kray) EsportsvBelgium (KRaftVK) Esports,5-1
11,03/25 05:36,-,Spain (labotryas) EsportsvGermany (Upcake22) Esports,2-0
12,03/25 05:24,-,Belgium (KRaftVK) EsportsvPortugal (MeLToSiK) Esports,0-0
13,03/25 05:24,-,Germany (Upcake22) EsportsvFrance (Kray) Esports,0-1
14,03/25 05:12,-,Portugal (MeLToSiK) EsportsvGermany (Upcake22) Esports,0-0
15,03/25 05:00,-,Spain (labotryas) EsportsvPortugal (MeLToSiK) Esports,0-3
16,03/25 05:00,-,Germany (Upcake22) EsportsvBelgium (KRaftVK) Esports,2-1
17,03/25 04:48,-,Spain (labotryas) EsportsvBelgium (KRaftVK) Esports,2-0
18,03/25 04:47,-,Portugal (MeLToSiK) EsportsvFrance (Kray) Esports,1-0
19,03/25 04:36,-,Germany (Upcake22) EsportsvSpain (labotryas) Esports,0-3
20,03/25 04:36,-,Belgium (KRaftVK) EsportsvFrance (Kray) Esports,1-2
21,03/25 04:24,-,France (Kray) EsportsvGermany (Upcake22) Esports,0-0
22,03/25 04:24,-,Portugal (MeLToSiK) EsportsvBelgium (KRaftVK) Esports,1-1
23,03/25 04:12,-,Germany (Upcake22) EsportsvPortugal (MeLToSiK) Esports,0-0
24,03/25 04:08,-,France (Kray) EsportsvSpain (labotryas) Esports,0-1
25,03/25 04:08,-,France (Kray) EsportsvPortugal (MeLToSiK) Esports,0-0
26,03/25 04:00,-,Belgium (KRaftVK) EsportsvGermany (Upcake22) Esports,0-0
27,03/25 04:00,-,Portugal (MeLToSiK) EsportsvSpain (labotryas) Esports,0-3
28,03/25 03:48,-,Chelsea (KRaftVK) EsportsvAtletico Madrid (labotryas) Esports,1-5
29,03/25 03:36,-,Ajax (Kray) EsportsvChelsea (KRaftVK) Esports,0-1
0,03/25 08:17,-,Tottenham (dm1trena) EsportsvMan City (nikkitta) Esports,1-0
1,03/25 08:16,-,Arsenal (orlovsky1) EsportsvMan United (slezaintima) Esports,1-0
2,03/25 08:16,-,Man United (slezaintima) EsportsvLiverpool (DangerDim77) Esports,0-2
3,03/25 08:08,-,Lokomotiv Moscow (LaikingDast) EsportsvSpartak Moscow (Arcos) Esports,1-1
4,03/25 08:08,-,Shakhtar Donetsk (KravaRK) EsportsvCSKA Moscow (Hrusch) Esports,0-1
5,03/25 08:06,-,Man City (nikkitta) EsportsvLiverpool (DangerDim77) Esports,1-2
6,03/25 08:06,-,Arsenal (orlovsky1) EsportsvTottenham (dm1trena) Esports,2-1
7,03/25 07:58,-,Spartak Moscow (Arcos) EsportsvShakhtar Donetsk (KravaRK) Esports,2-2
8,03/25 07:57,-,CSKA Moscow (Hrusch) EsportsvDynamo Kyiv (vrico) Esports,1-2
9,03/25 07:55,-,Liverpool (nikkitta) EsportsvPSG (slezaintima) Esports,1-0
10,03/25 07:55,-,ManCity (orlovsky1) EsportsvBarcelona (DangerDim77) Esports,4-2
11,03/25 07:55,-,Man United (slezaintima) EsportsvMan City (nikkitta) Esports,1-2
12,03/25 07:55,-,Liverpool (DangerDim77) EsportsvMan United (slezaintima) Esports,2-2
13,03/25 07:47,-,Dynamo Kyiv (vrico) EsportsvSpartak Moscow (Arcos) Esports,0-2
14,03/25 07:47,-,Shakhtar Donetsk (KravaRK) EsportsvLokomotiv Moscow (LaikingDast) Esports,1-1
15,03/25 07:45,-,Barcelona (DangerDim77) EsportsvReal Madrid (dm1trena) Esports,3-4
16,03/25 07:44,-,PSG (slezaintima) EsportsvManCity (orlovsky1) Esports,1-2
17,03/25 07:37,-,Lokomotiv Moscow (LaikingDast) EsportsvDynamo Kyiv (vrico) Esports,0-0
18,03/25 07:37,-,Spartak Moscow (Arcos) EsportsvCSKA Moscow (Hrusch) Esports,0-0
19,03/25 07:34,-,ManCity (orlovsky1) EsportsvLiverpool (nikkitta) Esports,2-1
20,03/25 07:34,-,Real Madrid (dm1trena) EsportsvPSG (slezaintima) Esports,0-0
21,03/25 07:28,-,Lokomotiv Moscow (LaikingDast) EsportsvCSKA Moscow (Hrusch) Esports,0-3
22,03/25 07:12,-,Liverpool (nikkitta) EsportsvReal Madrid (dm1trena) Esports,0-0
23,03/25 07:06,-,CSKA Moscow (Hrusch) EsportsvShakhtar Donetsk (KravaRK) Esports,0-0
24,03/25 07:00,-,Real Madrid (dm1trena) EsportsvManCity (orlovsky1) Esports,1-2
25,03/25 07:00,-,Barcelona (DangerDim77) EsportsvLiverpool (nikkitta) Esports,0-2
26,03/25 06:54,-,Shakhtar Donetsk (KravaRK) EsportsvSpartak Moscow (Arcos) Esports,0-2
27,03/25 06:48,-,PSG (slezaintima) EsportsvLiverpool (nikkitta) Esports,1-1
28,03/25 06:48,-,Barcelona (DangerDim77) EsportsvManCity (orlovsky1) Esports,0-1
29,03/25 06:42,-,Spartak Moscow (Arcos) EsportsvDynamo Kyiv (vrico) Esports,2-2
0,03/25 09:54,-,M'Gladbach (Arcos) EsportsvDortmund (KravaRK) Esports,1-1
1,03/25 09:48,-,Arsenal (orlovsky1) EsportsvLiverpool (DangerDim77) Esports,0-3
2,03/25 09:42,-,Leverkusen (vrico) EsportsvM'Gladbach (Arcos) Esports,0-5
3,03/25 09:42,-,Dortmund (KravaRK) EsportsvBayern (LaikingDast) Esports,0-1
4,03/25 09:36,-,Liverpool (DangerDim77) EsportsvTottenham (dm1trena) Esports,2-2
5,03/25 09:36,-,Man United (slezaintima) EsportsvArsenal (orlovsky1) Esports,0-1
6,03/25 09:30,-,Bayern (LaikingDast) EsportsvLeverkusen (vrico) Esports,0-0
7,03/25 09:30,-,M'Gladbach (Arcos) EsportsvLeipzig (Hrusch) Esports,0-1
8,03/25 09:24,-,Tottenham (dm1trena) EsportsvMan United (slezaintima) Esports,0-3
9,03/25 09:24,-,Arsenal (orlovsky1) EsportsvMan City (nikkitta) Esports,0-0
10,03/25 09:18,-,Bayern (LaikingDast) EsportsvLeipzig (Hrusch) Esports,0-0
11,03/25 09:18,-,Dortmund (KravaRK) EsportsvLeverkusen (vrico) Esports,2-1
12,03/25 09:12,-,Man City (nikkitta) EsportsvTottenham (dm1trena) Esports,1-1
13,03/25 09:06,-,M'Gladbach (Arcos) EsportsvBayern (LaikingDast) Esports,1-1
14,03/25 09:06,-,Leipzig (Hrusch) EsportsvDortmund (KravaRK) Esports,3-0
15,03/25 09:01,-,Liverpool (DangerDim77) EsportsvMan City (nikkitta) Esports,0-3
16,03/25 09:01,-,Tottenham (dm1trena) EsportsvArsenal (orlovsky1) Esports,2-0
17,03/25 08:54,-,Dortmund (KravaRK) EsportsvM'Gladbach (Arcos) Esports,3-0
18,03/25 08:54,-,Leverkusen (vrico) EsportsvLeipzig (Hrusch) Esports,0-0
19,03/25 08:50,-,Liverpool (DangerDim77) EsportsvArsenal (orlovsky1) Esports,1-4
20,03/25 08:49,-,Man City (nikkitta) EsportsvMan United (slezaintima) Esports,2-0
21,03/25 08:42,-,Bayern (LaikingDast) EsportsvDortmund (KravaRK) Esports,2-2
22,03/25 08:40,-,M'Gladbach (Arcos) EsportsvLeverkusen (vrico) Esports,1-0
23,03/25 08:39,-,Tottenham (dm1trena) EsportsvLiverpool (DangerDim77) Esports,1-1
24,03/25 08:30,-,Leipzig (Hrusch) EsportsvM'Gladbach (Arcos) Esports,2-1
25,03/25 08:30,-,Leverkusen (vrico) EsportsvBayern (LaikingDast) Esports,1-0
26,03/25 08:28,-,Man City (nikkitta) EsportsvArsenal (orlovsky1) Esports,3-0
27,03/25 08:28,-,Man United (slezaintima) EsportsvTottenham (dm1trena) Esports,0-3
28,03/25 08:18,-,CSKA Moscow (Hrusch) EsportsvLokomotiv Moscow (LaikingDast) Esports,1-2
29,03/25 08:18,-,Dynamo Kyiv (vrico) EsportsvShakhtar Donetsk (KravaRK) Esports,2-3
0,03/25 11:54,-,PSG (orlovsky1) EsportsvNapoli (nikkitta) Esports,5-2
1,03/25 11:48,-,Man United (Pablik) EsportsvTottenham (Inquisitor) Esports,1-0
2,03/25 11:48,-,Man City (Olle) EsportsvArsenal (Chellovekk) Esports,0-3
3,03/25 11:42,-,Napoli (nikkitta) EsportsvBayern (dm1trena) Esports,1-1
4,03/25 11:36,-,Liverpool (mooneycb) EsportsvMan City (Olle) Esports,2-1
5,03/25 11:36,-,Arsenal (Chellovekk) EsportsvMan United (Pablik) Esports,2-2
6,03/25 11:30,-,Tottenham (DangerDim77) EsportsvNapoli (nikkitta) Esports,0-1
7,03/25 11:30,-,Bayern (dm1trena) EsportsvPSG (orlovsky1) Esports,0-0
8,03/25 11:24,-,Tottenham (Inquisitor) EsportsvArsenal (Chellovekk) Esports,1-0
9,03/25 11:24,-,Man United (Pablik) EsportsvLiverpool (mooneycb) Esports,3-1
10,03/25 11:18,-,Real Madrid (slezaintima) EsportsvNapoli (nikkitta) Esports,0-0
11,03/25 11:14,-,PSG (orlovsky1) EsportsvTottenham (DangerDim77) Esports,2-1
12,03/25 11:14,-,Man United (Pablik) EsportsvMan City (Olle) Esports,1-4
13,03/25 11:14,-,Real Madrid (slezaintima) EsportsvPSG (orlovsky1) Esports,0-0
14,03/25 11:10,-,Tottenham (Inquisitor) EsportsvLiverpool (mooneycb) Esports,1-1
15,03/25 11:06,-,Bayern (dm1trena) EsportsvTottenham (DangerDim77) Esports,1-0
16,03/25 11:00,-,Tottenham (Inquisitor) EsportsvMan City (Olle) Esports,0-1
17,03/25 11:00,-,Arsenal (Chellovekk) EsportsvLiverpool (mooneycb) Esports,2-0
18,03/25 10:55,-,Real Madrid (slezaintima) EsportsvBayern (dm1trena) Esports,1-1
19,03/25 10:54,-,Napoli (nikkitta) EsportsvPSG (orlovsky1) Esports,0-0
20,03/25 10:42,-,Bayern (dm1trena) EsportsvNapoli (nikkitta) Esports,0-0
21,03/25 10:41,-,Real Madrid (slezaintima) EsportsvTottenham (DangerDim77) Esports,2-2
22,03/25 10:40,-,PSG (orlovsky1) EsportsvReal Madrid (slezaintima) Esports,0-0
23,03/25 10:30,-,Napoli (nikkitta) EsportsvTottenham (DangerDim77) Esports,0-0
24,03/25 10:30,-,PSG (orlovsky1) EsportsvBayern (dm1trena) Esports,0-0
25,03/25 10:18,-,Leipzig (Hrusch) EsportsvBayern (LaikingDast) Esports,3-1
26,03/25 10:18,-,Leverkusen (vrico) EsportsvDortmund (KravaRK) Esports,3-0
27,03/25 10:07,-,Bayern (LaikingDast) EsportsvM'Gladbach (Arcos) Esports,2-3
28,03/25 10:06,-,Dortmund (KravaRK) EsportsvLeipzig (Hrusch) Esports,0-2
29,03/25 09:54,-,Leipzig (Hrusch) EsportsvLeverkusen (vrico) Esports,1-1
0,03/25 13:36,-,Belgium (Chellovek) EsportsvGermany (Pablik) Esports,2-4
1,03/25 13:33,-,Brazil (mooneycb) EsportsvSpain (Olle) Esports,1-1
2,03/25 13:30,-,Portugal (DangerDim77) EsportsvSpain (nikkitta) Esports,0-0
3,03/25 13:24,-,Germany (Pablik) EsportsvBrazil (mooneycb) Esports,0-2
4,03/25 13:21,-,Portugal (Inquisitor) EsportsvBelgium (Chellovek) Esports,1-0
5,03/25 13:18,-,England (slezaintima) EsportsvSpain (nikkitta) Esports,2-1
6,03/25 13:18,-,Portugal (DangerDim77) EsportsvNetherlands (orlovsky1) Esports,4-1
7,03/25 13:12,-,Brazil (mooneycb) EsportsvPortugal (Inquisitor) Esports,2-0
8,03/25 13:09,-,Spain (Olle) EsportsvGermany (Pablik) Esports,0-2
9,03/25 13:06,-,Netherlands (orlovsky1) EsportsvEngland (slezaintima) Esports,1-3
10,03/25 13:06,-,Italy (dm1trena) EsportsvPortugal (DangerDim77) Esports,1-0
11,03/25 12:56,-,Belgium (Chellovek) EsportsvBrazil (mooneycb) Esports,2-3
12,03/25 12:54,-,Spain (Olle) EsportsvPortugal (Inquisitor) Esports,1-0
13,03/25 12:54,-,Spain (nikkitta) EsportsvNetherlands (orlovsky1) Esports,2-1
14,03/25 12:48,-,Tottenham (Inquisitor) EsportsvMan United (Pablik) Esports,0-0
15,03/25 12:48,-,Arsenal (Chellovekk) EsportsvMan City (Olle) Esports,0-1
16,03/25 12:42,-,Italy (dm1trena) EsportsvSpain (nikkitta) Esports,2-0
17,03/25 12:42,-,Portugal (DangerDim77) EsportsvEngland (slezaintima) Esports,0-1
18,03/25 12:36,-,Man City (Olle) EsportsvLiverpool (mooneycb) Esports,0-0
19,03/25 12:36,-,Man United (Pablik) EsportsvArsenal (Chellovekk) Esports,0-2
20,03/25 12:30,-,Spain (nikkitta) EsportsvPortugal (DangerDim77) Esports,1-1
21,03/25 12:30,-,Italy (dm1trena) EsportsvNetherlands (orlovsky1) Esports,1-1
22,03/25 12:24,-,Liverpool (mooneycb) EsportsvMan United (Pablik) Esports,1-1
23,03/25 12:24,-,Arsenal (Chellovekk) EsportsvTottenham (Inquisitor) Esports,0-0
24,03/25 12:18,-,Napoli (nikkitta) EsportsvReal Madrid (slezaintima) Esports,0-0
25,03/25 12:18,-,Netherlands (orlovsky1) EsportsvItaly (dm1trena) Esports,1-1
26,03/25 12:06,-,Tottenham (DangerDim77) EsportsvBayern (dm1trena) Esports,1-1
27,03/25 12:00,-,Man City (Olle) EsportsvTottenham (Inquisitor) Esports,3-2
28,03/25 12:00,-,Liverpool (mooneycb) EsportsvArsenal (Chellovekk) Esports,2-1
29,03/25 11:54,-,Bayern (dm1trena) EsportsvReal Madrid (slezaintima) Esports,1-0
0,03/25 15:36,-,Bayern (FEARGGWP) EsportsvNapoli (PASHOK75) Esports,2-1
1,03/25 15:36,-,Real Madrid (Flewless_phoenix) EsportsvTottenham (kalibra) Esports,0-2
2,03/25 15:29,-,Ajax (Olle) EsportsvMan United(Inquisitor) Esports,0-0
3,03/25 15:26,-,Porto (Chellovekk) EsportsvLeverkusen (mooneycb) Esports,0-1
4,03/25 15:24,-,Napoli (PASHOK75) EsportsvReal Madrid (Flewless_phoenix) Esports,1-3
5,03/25 15:24,-,PSG (TAKA) EsportsvBayern (FEARGGWP) Esports,0-0
6,03/25 15:12,-,Napoli (PASHOK75) EsportsvTottenham (kalibra) Esports,2-1
7,03/25 15:05,-,Real Madrid (Flewless_phoenix) EsportsvPSG (TAKA) Esports,1-0
8,03/25 15:01,-,Bayern (FEARGGWP) EsportsvReal Madrid (Flewless_phoenix) Esports,0-1
9,03/25 14:55,-,PSG (TAKA) EsportsvTottenham (kalibra) Esports,3-1
10,03/25 14:48,-,Portugal (Inquisitor) EsportsvGermany (Pablik) Esports,1-0
11,03/25 14:48,-,Belgium (Chellovek) EsportsvSpain (Olle) Esports,0-0
12,03/25 14:48,-,Tottenham (kalibra) EsportsvNapoli (PASHOK75) Esports,3-0
13,03/25 14:36,-,Germany (Pablik) EsportsvBelgium (Chellovek) Esports,4-0
14,03/25 14:32,-,Spain (Olle) EsportsvBrazil (mooneycb) Esports,0-1
15,03/25 14:24,-,Brazil (mooneycb) EsportsvGermany (Pablik) Esports,2-0
16,03/25 14:19,-,Belgium (Chellovek) EsportsvPortugal (Inquisitor) Esports,1-1
17,03/25 14:18,-,Spain (nikkitta) EsportsvEngland (slezaintima) Esports,0-0
18,03/25 14:18,-,Netherlands (orlovsky1) EsportsvPortugal (DangerDim77) Esports,3-0
19,03/25 14:12,-,Germany (Pablik) EsportsvSpain (Olle) Esports,1-2
20,03/25 14:12,-,Portugal (Inquisitor) EsportsvBrazil (mooneycb) Esports,1-1
21,03/25 14:08,-,England (slezaintima) EsportsvNetherlands (orlovsky1) Esports,0-2
22,03/25 14:06,-,Portugal (DangerDim77) EsportsvItaly (dm1trena) Esports,0-1
23,03/25 13:54,-,Italy (dm1trena) EsportsvEngland (slezaintima) Esports,2-1
24,03/25 13:54,-,Netherlands (orlovsky1) EsportsvSpain (nikkitta) Esports,0-0
25,03/25 13:50,-,Brazil (mooneycb) EsportsvBelgium (Chellovek) Esports,2-0
26,03/25 13:49,-,Spain (Olle) EsportsvBelgium (Chellovek) Esports,1-4
27,03/25 13:46,-,Germany (Pablik) EsportsvPortugal (Inquisitor) Esports,3-0
28,03/25 13:42,-,Spain (nikkitta) EsportsvItaly (dm1trena) Esports,0-0
29,03/25 13:42,-,England (slezaintima) EsportsvPortugal (DangerDim77) Esports,2-0
0,03/25 17:12,-,Tottenham (PASHOK75) EsportsvLiverpool (kalibra) Esports,1-1
1,03/25 17:12,-,Arsenal (Flewless_phoenix) EsportsvMan City (taka) Esports,0-0
2,03/25 17:06,-,Valencia (Pablik) EsportsvPorto (Chellovekk) Esports,2-1
3,03/25 17:06,-,Ajax (Olle) EsportsvLeverkusen (mooneycb) Esports,0-3
4,03/25 17:00,-,Man City (taka) EsportsvLiverpool (kalibra) Esports,0-2
5,03/25 16:54,-,Porto (Chellovekk) EsportsvMan United(Inquisitor) Esports,1-1
6,03/25 16:54,-,Leverkusen (mooneycb) EsportsvValencia (Pablik) Esports,2-0
7,03/25 16:50,-,Man United (fearggwp) EsportsvArsenal (Flewless_phoenix) Esports,1-0
