,Date,R,Casa v Visitante,-
13,04/06 15:30,-,Ajax (Arcos) EsportsvLeverkusen (Nikkitta) Esports,2-1
14,04/06 15:24,-,Real Madrid (FEARGGWP) EsportsvBayern (Taka) Esports,4-0
15,04/06 15:18,-,Valencia (Boulevard_Prospect) EsportsvLeverkusen (Nikkitta) Esports,1-1
16,04/06 15:18,-,Porto (Hrusch) EsportsvMan United (Skromnuy) Esports,0-0
17,04/06 15:12,-,Bayern (Taka) EsportsvTottenham (Flewless_phoenix) Esports,0-0
18,04/06 15:12,-,Napoli (PASHOK75) EsportsvPSG (Kalibra) Esports,0-0
19,04/06 15:06,-,Ajax (Arcos) EsportsvValencia (Boulevard_Prospect) Esports,0-2
20,04/06 15:06,-,Leverkusen (Nikkitta) EsportsvPorto (Hrusch) Esports,3-0
21,04/06 15:00,-,PSG (Kalibra) EsportsvBayern (Taka) Esports,1-0
22,04/06 15:00,-,Tottenham (Flewless_phoenix) EsportsvReal Madrid (FEARGGWP) Esports,0-1
23,04/06 14:54,-,Porto (Hrusch) EsportsvAjax (Arcos) Esports,2-1
24,04/06 14:54,-,Man United (Skromnuy) EsportsvLeverkusen (Nikkitta) Esports,0-1
25,04/06 14:48,-,Napoli (PASHOK75) EsportsvBayern (Taka) Esports,2-0
26,04/06 14:48,-,PSG (Kalibra) EsportsvReal Madrid (FEARGGWP) Esports,1-0
27,04/06 14:42,-,Valencia (Boulevard_Prospect) EsportsvPorto (Hrusch) Esports,2-2
28,04/06 14:42,-,Ajax (Arcos) EsportsvMan United (Skromnuy) Esports,1-1
29,04/06 14:36,-,Real Madrid (FEARGGWP) EsportsvNapoli (PASHOK75) Esports,1-0
0,04/06 17:30,-,Barcelona (Arcos) EsportsvMan City (nikkitta) Esports,0-3
1,04/06 17:30,-,Real Madrid (Boulevard_Prospect) EsportsvPSG (Skromnuy) Esports,3-1
2,04/06 17:24,-,Man City (Flewless_phoenix) EsportsvLiverpool (PASHOK75) Esports,1-2
3,04/06 17:18,-,Liverpool (Hrusch) EsportsvPSG (Skromnuy) Esports,3-1
4,04/06 17:18,-,Real Madrid (Boulevard_Prospect) EsportsvMan City (nikkitta) Esports,0-2
5,04/06 17:13,-,Arsenal (FEARGGWP) EsportsvMan Utd (kalibra) Esports,1-1
6,04/06 17:13,-,Liverpool (PASHOK75) EsportsvArsenal (FEARGGWP) Esports,2-0
7,04/06 17:12,-,Liverpool (PASHOK75) EsportsvMan Utd (kalibra) Esports,1-1
8,04/06 17:12,-,Tottenham (TAKA) EsportsvMan City (Flewless_phoenix) Esports,1-1
9,04/06 17:11,-,Arsenal (FEARGGWP) EsportsvTottenham (TAKA) Esports,0-0
10,04/06 17:06,-,Barcelona (Arcos) EsportsvReal Madrid (Boulevard_Prospect) Esports,1-1
11,04/06 17:06,-,Man City (nikkitta) EsportsvLiverpool (Hrusch) Esports,0-4
12,04/06 17:00,-,Man Utd (kalibra) EsportsvTottenham (TAKA) Esports,2-0
13,04/06 16:54,-,PSG (Skromnuy) EsportsvMan City (nikkitta) Esports,3-2
14,04/06 16:54,-,Liverpool (Hrusch) EsportsvBarcelona (Arcos) Esports,1-0
15,04/06 16:48,-,Liverpool (PASHOK75) EsportsvTottenham (TAKA) Esports,1-4
16,04/06 16:47,-,Man City (Flewless_phoenix) EsportsvArsenal (FEARGGWP) Esports,2-2
17,04/06 16:42,-,Real Madrid (Boulevard_Prospect) EsportsvLiverpool (Hrusch) Esports,1-1
18,04/06 16:42,-,Barcelona (Arcos) EsportsvPSG (Skromnuy) Esports,2-1
19,04/06 16:36,-,Man City (Flewless_phoenix) EsportsvMan Utd (kalibra) Esports,1-2
20,04/06 16:34,-,Man Utd (kalibra) EsportsvArsenal (FEARGGWP) Esports,1-3
21,04/06 16:30,-,Man City (nikkitta) EsportsvBarcelona (Arcos) Esports,0-0
22,04/06 16:30,-,PSG (Skromnuy) EsportsvReal Madrid (Boulevard_Prospect) Esports,0-4
23,04/06 16:24,-,Liverpool (PASHOK75) EsportsvMan City (Flewless_phoenix) Esports,1-4
24,04/06 16:24,-,Tottenham (TAKA) EsportsvArsenal (FEARGGWP) Esports,2-2
25,04/06 16:18,-,Leverkusen (Nikkitta) EsportsvValencia (Boulevard_Prospect) Esports,2-1
26,04/06 16:18,-,Man United (Skromnuy) EsportsvPorto (Hrusch) Esports,2-1
27,04/06 16:12,-,Man City (Flewless_phoenix) EsportsvTottenham (TAKA) Esports,0-1
28,04/06 16:12,-,Man Utd (kalibra) EsportsvLiverpool (PASHOK75) Esports,1-3
29,04/06 16:06,-,Valencia (Boulevard_Prospect) EsportsvAjax (Arcos) Esports,1-1
0,04/06 20:18,-,Borussia Dortmund (FEARGGWP) EsportsvChelsea (kalibra) Esports,0-1
1,04/06 20:18,-,Atletico Madrid (SALAYYY) EsportsvInter Milan (PASHOK75) Esports,0-1
2,04/06 20:06,-,Inter Milan (PASHOK75) EsportsvBorussia Dortmund (FEARGGWP) Esports,0-2
3,04/06 20:06,-,Chelsea (kalibra) EsportsvAjax (Flewless_phoenix) Esports,1-1
4,04/06 19:54,-,Ajax (Flewless_phoenix) EsportsvInter Milan (PASHOK75) Esports,0-1
5,04/06 19:54,-,Borussia Dortmund (FEARGGWP) EsportsvAtletico Madrid (SALAYYY) Esports,2-0
6,04/06 19:42,-,Atletico Madrid (SALAYYY) EsportsvAjax (Flewless_phoenix) Esports,0-3
7,04/06 19:42,-,Inter Milan (PASHOK75) EsportsvChelsea (kalibra) Esports,4-1
8,04/06 19:30,-,Chelsea (kalibra) EsportsvAtletico Madrid (SALAYYY) Esports,0-2
9,04/06 19:30,-,Ajax (Flewless_phoenix) EsportsvBorussia Dortmund (FEARGGWP) Esports,0-0
10,04/06 19:18,-,Chelsea (kalibra) EsportsvBorussia Dortmund (FEARGGWP) Esports,0-0
11,04/06 19:18,-,Inter Milan (PASHOK75) EsportsvAtletico Madrid (SALAYYY) Esports,0-1
12,04/06 19:06,-,Borussia Dortmund (FEARGGWP) EsportsvInter Milan (PASHOK75) Esports,2-1
13,04/06 19:06,-,Ajax (Flewless_phoenix) EsportsvChelsea (kalibra) Esports,1-0
14,04/06 18:54,-,Atletico Madrid (SALAYYY) EsportsvBorussia Dortmund (FEARGGWP) Esports,1-1
15,04/06 18:54,-,Inter Milan (PASHOK75) EsportsvAjax (Flewless_phoenix) Esports,1-3
16,04/06 18:42,-,Ajax (Flewless_phoenix) EsportsvAtletico Madrid (SALAYYY) Esports,2-3
17,04/06 18:42,-,Chelsea (kalibra) EsportsvInter Milan (PASHOK75) Esports,1-0
18,04/06 18:30,-,Atletico Madrid (SALAYYY) EsportsvChelsea (kalibra) Esports,1-0
19,04/06 18:30,-,Borussia Dortmund (FEARGGWP) EsportsvAjax (Flewless_phoenix) Esports,1-0
20,04/06 18:18,-,PSG (Skromnuy) EsportsvLiverpool (Hrusch) Esports,2-2
21,04/06 18:18,-,Man City (nikkitta) EsportsvReal Madrid (Boulevard_Prospect) Esports,2-1
22,04/06 18:06,-,Real Madrid (Boulevard_Prospect) EsportsvBarcelona (Arcos) Esports,1-1
23,04/06 18:06,-,Liverpool (Hrusch) EsportsvMan City (nikkitta) Esports,0-0
24,04/06 17:54,-,Barcelona (Arcos) EsportsvLiverpool (Hrusch) Esports,0-0
25,04/06 17:54,-,Man City (nikkitta) EsportsvPSG (Skromnuy) Esports,1-0
26,04/06 17:48,-,Tottenham (TAKA) EsportsvLiverpool (PASHOK75) Esports,1-3
27,04/06 17:42,-,PSG (Skromnuy) EsportsvBarcelona (Arcos) Esports,2-3
28,04/06 17:42,-,Liverpool (Hrusch) EsportsvReal Madrid (Boulevard_Prospect) Esports,1-0
29,04/06 17:36,-,Man Utd (kalibra) EsportsvMan City (Flewless_phoenix) Esports,1-1
0,04/06 21:54,-,Arsenal (labotryas) EsportsvTottenham (MeLToSiK) Esports,0-2
1,04/06 21:54,-,Man City (Upcake22) EsportsvMan Utd (Kray) Esports,0-0
2,04/06 21:42,-,France (PASHOK75) EsportsvBelgium (kalibra) Esports,0-1
3,04/06 21:42,-,Germany (SALAYYY) EsportsvPortugal (Flewless_phoenix) Esports,0-0
4,04/06 21:42,-,Man Utd (Kray) EsportsvLiverpool (KRaftVK) Esports,0-0
5,04/06 21:42,-,Tottenham (MeLToSiK) EsportsvMan City (Upcake22) Esports,2-0
6,04/06 21:30,-,Belgium (kalibra) EsportsvGermany (SALAYYY) Esports,1-2
7,04/06 21:30,-,Man City (Upcake22) EsportsvArsenal (labotryas) Esports,0-0
8,04/06 21:30,-,Liverpool (KRaftVK) EsportsvTottenham (MeLToSiK) Esports,2-0
9,04/06 21:30,-,Portugal (Flewless_phoenix) EsportsvSpain (FEARGGWP) Esports,2-2
10,04/06 21:18,-,Belgium (kalibra) EsportsvSpain (FEARGGWP) Esports,0-0
11,04/06 21:18,-,Liverpool (KRaftVK) EsportsvArsenal (labotryas) Esports,1-1
12,04/06 21:18,-,France (PASHOK75) EsportsvGermany (SALAYYY) Esports,1-2
13,04/06 21:18,-,Man Utd (Kray) EsportsvTottenham (MeLToSiK) Esports,1-0
14,04/06 21:06,-,Portugal (Flewless_phoenix) EsportsvBelgium (kalibra) Esports,1-1
15,04/06 21:06,-,Spain (FEARGGWP) EsportsvFrance (PASHOK75) Esports,1-2
16,04/06 21:06,-,Man City (Upcake22) EsportsvLiverpool (KRaftVK) Esports,1-3
17,04/06 21:06,-,Arsenal (labotryas) EsportsvMan Utd (Kray) Esports,1-1
18,04/06 20:54,-,France (PASHOK75) EsportsvPortugal (Flewless_phoenix) Esports,2-2
19,04/06 20:54,-,Germany (SALAYYY) EsportsvSpain (FEARGGWP) Esports,1-1
20,04/06 20:54,-,Tottenham (MeLToSiK) EsportsvArsenal (labotryas) Esports,2-3
21,04/06 20:54,-,Man Utd (Kray) EsportsvMan City (Upcake22) Esports,0-0
22,04/06 20:42,-,Portugal (Flewless_phoenix) EsportsvGermany (SALAYYY) Esports,1-0
23,04/06 20:42,-,Belgium (kalibra) EsportsvFrance (PASHOK75) Esports,0-2
24,04/06 20:42,-,Liverpool (KRaftVK) EsportsvMan Utd (Kray) Esports,1-0
25,04/06 20:42,-,Man City (Upcake22) EsportsvTottenham (MeLToSiK) Esports,1-0
26,04/06 20:30,-,Germany (SALAYYY) EsportsvBelgium (kalibra) Esports,2-1
27,04/06 20:30,-,Spain (FEARGGWP) EsportsvPortugal (Flewless_phoenix) Esports,0-1
28,04/06 20:30,-,Arsenal (labotryas) EsportsvMan City (Upcake22) Esports,0-0
29,04/06 20:30,-,Tottenham (MeLToSiK) EsportsvLiverpool (KRaftVK) Esports,1-1
0,04/07 00:18,-,Tottenham (labotryas) EsportsvBayern(KRaftVK) Esports,5-1
1,04/07 00:18,-,Napoli (MeLToSiK) EsportsvReal Madrid (Kray) Esports,0-2
2,04/07 00:06,-,Bayern(KRaftVK) EsportsvPSG (Upcake22) Esports,0-0
3,04/07 00:06,-,Real Madrid (Kray) EsportsvTottenham (labotryas) Esports,1-1
4,04/06 23:54,-,Tottenham (labotryas) EsportsvNapoli (MeLToSiK) Esports,1-1
5,04/06 23:54,-,PSG (Upcake22) EsportsvReal Madrid (Kray) Esports,1-0
6,04/06 23:42,-,Napoli (MeLToSiK) EsportsvPSG (Upcake22) Esports,2-1
7,04/06 23:42,-,Real Madrid (Kray) EsportsvBayern(KRaftVK) Esports,0-1
8,04/06 23:30,-,PSG (Upcake22) EsportsvTottenham (labotryas) Esports,0-0
9,04/06 23:30,-,Bayern(KRaftVK) EsportsvNapoli (MeLToSiK) Esports,0-2
10,04/06 23:18,-,Real Madrid (Kray) EsportsvNapoli (MeLToSiK) Esports,1-1
11,04/06 23:18,-,Bayern(KRaftVK) EsportsvTottenham (labotryas) Esports,0-1
12,04/06 23:06,-,PSG (Upcake22) EsportsvBayern(KRaftVK) Esports,1-0
13,04/06 23:06,-,Tottenham (labotryas) EsportsvReal Madrid (Kray) Esports,0-0
14,04/06 22:54,-,Real Madrid (Kray) EsportsvPSG (Upcake22) Esports,0-0
15,04/06 22:54,-,Napoli (MeLToSiK) EsportsvTottenham (labotryas) Esports,0-1
16,04/06 22:42,-,Bayern(KRaftVK) EsportsvReal Madrid (Kray) Esports,1-0
17,04/06 22:42,-,PSG (Upcake22) EsportsvNapoli (MeLToSiK) Esports,1-5
18,04/06 22:30,-,Napoli (MeLToSiK) EsportsvBayern(KRaftVK) Esports,1-0
19,04/06 22:30,-,Tottenham (labotryas) EsportsvPSG (Upcake22) Esports,0-0
20,04/06 22:18,-,Germany (SALAYYY) EsportsvFrance (PASHOK75) Esports,1-2
21,04/06 22:18,-,Tottenham (MeLToSiK) EsportsvMan Utd (Kray) Esports,2-0
22,04/06 22:18,-,Arsenal (labotryas) EsportsvLiverpool (KRaftVK) Esports,2-2
23,04/06 22:18,-,Spain (FEARGGWP) EsportsvBelgium (kalibra) Esports,0-1
24,04/06 22:06,-,Liverpool (KRaftVK) EsportsvMan City (Upcake22) Esports,0-0
25,04/06 22:06,-,France (PASHOK75) EsportsvSpain (FEARGGWP) Esports,0-0
26,04/06 22:06,-,Man Utd (Kray) EsportsvArsenal (labotryas) Esports,0-3
27,04/06 22:06,-,Belgium (kalibra) EsportsvPortugal (Flewless_phoenix) Esports,3-2
28,04/06 21:54,-,Spain (FEARGGWP) EsportsvGermany (SALAYYY) Esports,1-1
29,04/06 21:54,-,Portugal (Flewless_phoenix) EsportsvFrance (PASHOK75) Esports,2-2
0,04/07 03:48,-,France (Kray) EsportsvPortugal (MeLToSiK) Esports,0-4
1,04/07 03:48,-,Belgium (KRaftVK) EsportsvSpain (labotryas) Esports,0-2
2,04/07 03:36,-,Germany (Upcake22) EsportsvBelgium (KRaftVK) Esports,1-1
3,04/07 03:36,-,Spain (labotryas) EsportsvFrance (Kray) Esports,1-1
4,04/07 03:24,-,Portugal (MeLToSiK) EsportsvSpain (labotryas) Esports,2-2
5,04/07 03:24,-,France (Kray) EsportsvGermany (Upcake22) Esports,1-1
6,04/07 03:12,-,Belgium (KRaftVK) EsportsvFrance (Kray) Esports,0-0
7,04/07 03:12,-,Germany (Upcake22) EsportsvPortugal (MeLToSiK) Esports,0-1
8,04/07 03:00,-,Portugal (MeLToSiK) EsportsvBelgium (KRaftVK) Esports,0-3
9,04/07 03:00,-,Spain (labotryas) EsportsvGermany (Upcake22) Esports,0-0
10,04/07 02:48,-,Atletico Madrid (MeLToSiK) EsportsvChelsea (Kray) Esports,3-1
11,04/07 02:48,-,Inter (labotryas) EsportsvDortmund (KRaftVK) Esports,1-1
12,04/07 02:36,-,Chelsea (Kray) EsportsvInter (labotryas) Esports,1-0
13,04/07 02:36,-,Dortmund (KRaftVK) EsportsvAjax (Upcake22) Esports,1-3
14,04/07 02:24,-,Inter (labotryas) EsportsvAtletico Madrid (MeLToSiK) Esports,2-0
15,04/07 02:24,-,Ajax (Upcake22) EsportsvChelsea (Kray) Esports,1-0
16,04/07 02:12,-,Chelsea (Kray) EsportsvDortmund (KRaftVK) Esports,0-2
17,04/07 02:12,-,Atletico Madrid (MeLToSiK) EsportsvAjax (Upcake22) Esports,1-1
18,04/07 02:00,-,Ajax (Upcake22) EsportsvInter (labotryas) Esports,0-0
19,04/07 02:00,-,Dortmund (KRaftVK) EsportsvAtletico Madrid (MeLToSiK) Esports,0-1
20,04/07 01:48,-,Chelsea (Kray) EsportsvAtletico Madrid (MeLToSiK) Esports,0-2
21,04/07 01:48,-,Dortmund (KRaftVK) EsportsvInter (labotryas) Esports,0-0
22,04/07 01:36,-,Ajax (Upcake22) EsportsvDortmund (KRaftVK) Esports,0-0
23,04/07 01:36,-,Inter (labotryas) EsportsvChelsea (Kray) Esports,1-1
24,04/07 01:24,-,Atletico Madrid (MeLToSiK) EsportsvInter (labotryas) Esports,2-2
25,04/07 01:24,-,Chelsea (Kray) EsportsvAjax (Upcake22) Esports,2-0
26,04/07 01:12,-,Dortmund (KRaftVK) EsportsvChelsea (Kray) Esports,1-0
27,04/07 01:12,-,Ajax (Upcake22) EsportsvAtletico Madrid (MeLToSiK) Esports,0-0
28,04/07 01:00,-,Inter (labotryas) EsportsvAjax (Upcake22) Esports,0-0
29,04/07 01:00,-,Atletico Madrid (MeLToSiK) EsportsvDortmund (KRaftVK) Esports,0-2
0,04/07 06:06,-,Loko Moscow (Kodak) EsportsvDynamo Kyiv (Skromnuy) Esports,1-1
1,04/07 06:06,-,Shakhtar Donetsk (Lomik) EsportsvSpartak Moscow (Mr.Jab) Esports,3-0
2,04/07 06:00,-,PSG (nikkitta) EsportsvBarcelona (DangerDim77) Esports,1-1
3,04/07 06:00,-,Real Madrid (Boulevard_Prospect) EsportsvLiverpool (orlovsky1) Esports,1-4
4,04/07 05:54,-,Dynamo Kyiv (Skromnuy) EsportsvShakhtar Donetsk (Lomik) Esports,0-3
5,04/07 05:54,-,CSKA Moscow (KravaRK) EsportsvLoko Moscow (Kodak) Esports,0-0
6,04/07 05:48,-,Man City (Arcos) EsportsvLiverpool (orlovsky1) Esports,3-1
7,04/07 05:48,-,Real Madrid (Boulevard_Prospect) EsportsvBarcelona (DangerDim77) Esports,0-2
8,04/07 05:42,-,Shakhtar Donetsk (Lomik) EsportsvCSKA Moscow (KravaRK) Esports,3-1
9,04/07 05:42,-,Spartak Moscow (Mr.Jab) EsportsvDynamo Kyiv (Skromnuy) Esports,2-1
10,04/07 05:36,-,Barcelona (DangerDim77) EsportsvMan City (Arcos) Esports,0-0
11,04/07 05:36,-,PSG (nikkitta) EsportsvReal Madrid (Boulevard_Prospect) Esports,1-0
12,04/07 05:30,-,CSKA Moscow (KravaRK) EsportsvSpartak Moscow (Mr.Jab) Esports,0-1
13,04/07 05:30,-,Loko Moscow (Kodak) EsportsvShakhtar Donetsk (Lomik) Esports,1-1
14,04/07 05:24,-,Man City (Arcos) EsportsvPSG (nikkitta) Esports,1-0
15,04/07 05:24,-,Liverpool (orlovsky1) EsportsvBarcelona (DangerDim77) Esports,0-0
16,04/07 05:12,-,Real Madrid (Boulevard_Prospect) EsportsvMan City (Arcos) Esports,0-1
17,04/07 05:12,-,PSG (nikkitta) EsportsvLiverpool (orlovsky1) Esports,1-1
18,04/07 05:00,-,Barcelona (DangerDim77) EsportsvPSG (nikkitta) Esports,0-1
19,04/07 05:00,-,Liverpool (orlovsky1) EsportsvReal Madrid (Boulevard_Prospect) Esports,1-3
20,04/07 04:48,-,Portugal (MeLToSiK) EsportsvFrance (Kray) Esports,1-2
21,04/07 04:48,-,Spain (labotryas) EsportsvBelgium (KRaftVK) Esports,2-1
22,04/07 04:36,-,Belgium (KRaftVK) EsportsvGermany (Upcake22) Esports,1-1
23,04/07 04:36,-,France (Kray) EsportsvSpain (labotryas) Esports,3-0
24,04/07 04:24,-,Spain (labotryas) EsportsvPortugal (MeLToSiK) Esports,1-1
25,04/07 04:24,-,Germany (Upcake22) EsportsvFrance (Kray) Esports,0-0
26,04/07 04:12,-,Portugal (MeLToSiK) EsportsvGermany (Upcake22) Esports,0-1
27,04/07 04:12,-,France (Kray) EsportsvBelgium (KRaftVK) Esports,1-2
28,04/07 04:00,-,Germany (Upcake22) EsportsvSpain (labotryas) Esports,2-1
29,04/07 04:00,-,Belgium (KRaftVK) EsportsvPortugal (MeLToSiK) Esports,0-0
0,04/07 07:36,-,Tottenham (nikkitta) EsportsvMan City (Boulevard_Prospect) Esports,2-0
1,04/07 07:36,-,Man United (DangerDim77) EsportsvLiverpool (Arcos) Esports,4-2
2,04/07 07:30,-,Bayern (Kodak) EsportsvM'Gladbach (Lomik) Esports,1-0
3,04/07 07:30,-,Leverkusen (KravaRK) EsportsvDortmund (Mr.Jab) Esports,1-0
4,04/07 07:24,-,Liverpool (Arcos) EsportsvTottenham (nikkitta) Esports,3-0
5,04/07 07:24,-,Arsenal (orlovsky1) EsportsvMan United (DangerDim77) Esports,0-0
6,04/07 07:18,-,Loko Moscow (Kodak) EsportsvSpartak Moscow (Mr.Jab) Esports,1-0
7,04/07 07:18,-,CSKA Moscow (KravaRK) EsportsvDynamo Kyiv (Skromnuy) Esports,1-1
8,04/07 07:12,-,Man City (Boulevard_Prospect) EsportsvLiverpool (Arcos) Esports,1-1
9,04/07 07:12,-,Tottenham (nikkitta) EsportsvArsenal (orlovsky1) Esports,3-0
10,04/07 07:06,-,Dynamo Kyiv (Skromnuy) EsportsvLoko Moscow (Kodak) Esports,0-1
11,04/07 07:06,-,Spartak Moscow (Mr.Jab) EsportsvShakhtar Donetsk (Lomik) Esports,0-2
12,04/07 07:00,-,Man United (DangerDim77) EsportsvTottenham (nikkitta) Esports,1-0
13,04/07 07:00,-,Arsenal (orlovsky1) EsportsvMan City (Boulevard_Prospect) Esports,2-0
14,04/07 06:54,-,Shakhtar Donetsk (Lomik) EsportsvDynamo Kyiv (Skromnuy) Esports,3-1
15,04/07 06:54,-,Loko Moscow (Kodak) EsportsvCSKA Moscow (KravaRK) Esports,2-2
16,04/07 06:48,-,Liverpool (orlovsky1) EsportsvMan City (Arcos) Esports,1-0
17,04/07 06:48,-,Barcelona (DangerDim77) EsportsvReal Madrid (Boulevard_Prospect) Esports,1-3
18,04/07 06:42,-,CSKA Moscow (KravaRK) EsportsvShakhtar Donetsk (Lomik) Esports,1-1
19,04/07 06:42,-,Dynamo Kyiv (Skromnuy) EsportsvSpartak Moscow (Mr.Jab) Esports,4-0
20,04/07 06:36,-,Man City (Arcos) EsportsvBarcelona (DangerDim77) Esports,1-1
21,04/07 06:36,-,Real Madrid (Boulevard_Prospect) EsportsvPSG (nikkitta) Esports,0-1
22,04/07 06:30,-,Spartak Moscow (Mr.Jab) EsportsvCSKA Moscow (KravaRK) Esports,0-0
23,04/07 06:30,-,Shakhtar Donetsk (Lomik) EsportsvLoko Moscow (Kodak) Esports,2-1
24,04/07 06:24,-,PSG (nikkitta) EsportsvMan City (Arcos) Esports,2-1
25,04/07 06:24,-,Barcelona (DangerDim77) EsportsvLiverpool (orlovsky1) Esports,2-0
26,04/07 06:18,-,Spartak Moscow (Mr.Jab) EsportsvLoko Moscow (Kodak) Esports,1-0
27,04/07 06:18,-,Dynamo Kyiv (Skromnuy) EsportsvCSKA Moscow (KravaRK) Esports,1-2
28,04/07 06:12,-,Man City (Arcos) EsportsvReal Madrid (Boulevard_Prospect) Esports,0-2
29,04/07 06:12,-,Liverpool (orlovsky1) EsportsvPSG (nikkitta) Esports,1-1
0,04/07 09:18,-,Leverkusen (KravaRK) EsportsvLeipzig (Skromnuy) Esports,2-1
1,04/07 09:18,-,Bayern (Kodak) EsportsvDortmund (Mr.Jab) Esports,0-2
2,04/07 09:06,-,Dortmund (Mr.Jab) EsportsvM'Gladbach (Lomik) Esports,1-1
3,04/07 09:06,-,Leipzig (Skromnuy) EsportsvBayern (Kodak) Esports,1-0
4,04/07 08:54,-,Bayern (Kodak) EsportsvLeverkusen (KravaRK) Esports,1-2
5,04/07 08:54,-,M'Gladbach (Lomik) EsportsvLeipzig (Skromnuy) Esports,0-5
6,04/07 08:48,-,Man United (DangerDim77) EsportsvMan City (Boulevard_Prospect) Esports,2-0
7,04/07 08:48,-,Arsenal (orlovsky1) EsportsvLiverpool (Arcos) Esports,2-0
8,04/07 08:42,-,Leipzig (Skromnuy) EsportsvDortmund (Mr.Jab) Esports,2-0
9,04/07 08:42,-,Leverkusen (KravaRK) EsportsvM'Gladbach (Lomik) Esports,2-2
10,04/07 08:36,-,Man City (Boulevard_Prospect) EsportsvTottenham (nikkitta) Esports,0-2
11,04/07 08:36,-,Liverpool (Arcos) EsportsvMan United (DangerDim77) Esports,1-1
12,04/07 08:30,-,Dortmund (Mr.Jab) EsportsvLeverkusen (KravaRK) Esports,1-1
13,04/07 08:30,-,M'Gladbach (Lomik) EsportsvBayern (Kodak) Esports,2-0
14,04/07 08:24,-,Tottenham (nikkitta) EsportsvLiverpool (Arcos) Esports,1-1
15,04/07 08:24,-,Man United (DangerDim77) EsportsvArsenal (orlovsky1) Esports,2-0
16,04/07 08:18,-,Leipzig (Skromnuy) EsportsvLeverkusen (KravaRK) Esports,0-1
17,04/07 08:18,-,Dortmund (Mr.Jab) EsportsvBayern (Kodak) Esports,2-0
18,04/07 08:12,-,Liverpool (Arcos) EsportsvMan City (Boulevard_Prospect) Esports,0-1
19,04/07 08:12,-,Arsenal (orlovsky1) EsportsvTottenham (nikkitta) Esports,1-3
20,04/07 08:06,-,M'Gladbach (Lomik) EsportsvDortmund (Mr.Jab) Esports,0-4
21,04/07 08:06,-,Bayern (Kodak) EsportsvLeipzig (Skromnuy) Esports,0-1
22,04/07 08:00,-,Man City (Boulevard_Prospect) EsportsvArsenal (orlovsky1) Esports,1-2
23,04/07 08:00,-,Tottenham (nikkitta) EsportsvMan United (DangerDim77) Esports,0-0
24,04/07 07:54,-,Leverkusen (KravaRK) EsportsvBayern (Kodak) Esports,2-2
25,04/07 07:54,-,Leipzig (Skromnuy) EsportsvM'Gladbach (Lomik) Esports,1-1
26,04/07 07:48,-,Man City (Boulevard_Prospect) EsportsvMan United (DangerDim77) Esports,0-1
27,04/07 07:48,-,Liverpool (Arcos) EsportsvArsenal (orlovsky1) Esports,1-1
28,04/07 07:42,-,M'Gladbach (Lomik) EsportsvLeverkusen (KravaRK) Esports,0-3
29,04/07 07:42,-,Dortmund (Mr.Jab) EsportsvLeipzig (Skromnuy) Esports,0-2
0,04/07 11:06,-,Real Madrid (Arcos) EsportsvTottenham (DangerDim77) Esports,0-0
1,04/07 11:05,-,PSG (Boulevard_Prospect) EsportsvBayern (nikkitta) Esports,1-0
2,04/07 11:00,-,Liverpool (Inquisitor) EsportsvArsenal (Chellovekk) Esports,4-0
3,04/07 11:00,-,Man Utd (mooneycb) EsportsvMan City (Olle) Esports,1-1
4,04/07 10:54,-,Tottenham (DangerDim77) EsportsvNapoli (orlovsky1) Esports,2-0
5,04/07 10:54,-,Bayern (nikkitta) EsportsvReal Madrid (Arcos) Esports,1-0
6,04/07 10:48,-,Liverpool (Inquisitor) EsportsvMan City (Olle) Esports,2-1
7,04/07 10:48,-,Tottenham (SALAYYY) EsportsvArsenal (Chellovekk) Esports,0-0
8,04/07 10:42,-,Napoli (orlovsky1) EsportsvBayern (nikkitta) Esports,4-1
9,04/07 10:40,-,Real Madrid (Arcos) EsportsvPSG (Boulevard_Prospect) Esports,4-0
10,04/07 10:36,-,Man Utd (mooneycb) EsportsvLiverpool (Inquisitor) Esports,0-0
11,04/07 10:36,-,Man City (Olle) EsportsvTottenham (SALAYYY) Esports,4-1
12,04/07 10:30,-,Bayern (nikkitta) EsportsvTottenham (DangerDim77) Esports,1-0
13,04/07 10:28,-,PSG (Boulevard_Prospect) EsportsvNapoli (orlovsky1) Esports,0-4
14,04/07 10:24,-,Tottenham (SALAYYY) EsportsvMan Utd (mooneycb) Esports,0-1
15,04/07 10:24,-,Arsenal (Chellovekk) EsportsvMan City (Olle) Esports,0-1
16,04/07 10:18,-,Real Madrid (Arcos) EsportsvNapoli (orlovsky1) Esports,0-0
17,04/07 10:18,-,PSG (Boulevard_Prospect) EsportsvTottenham (DangerDim77) Esports,0-1
18,04/07 10:12,-,Liverpool (Inquisitor) EsportsvTottenham (SALAYYY) Esports,3-1
19,04/07 10:12,-,Man Utd (mooneycb) EsportsvArsenal (Chellovekk) Esports,1-0
20,04/07 10:06,-,Tottenham (DangerDim77) EsportsvReal Madrid (Arcos) Esports,2-1
21,04/07 10:06,-,Bayern (nikkitta) EsportsvPSG (Boulevard_Prospect) Esports,1-1
22,04/07 10:00,-,Man City (Olle) EsportsvMan Utd (mooneycb) Esports,0-1
23,04/07 10:00,-,Arsenal (Chellovekk) EsportsvLiverpool (Inquisitor) Esports,0-0
24,04/07 09:54,-,Real Madrid (Arcos) EsportsvBayern (nikkitta) Esports,1-0
25,04/07 09:54,-,Napoli (orlovsky1) EsportsvTottenham (DangerDim77) Esports,2-1
26,04/07 09:42,-,Bayern (nikkitta) EsportsvNapoli (orlovsky1) Esports,1-2
27,04/07 09:42,-,PSG (Boulevard_Prospect) EsportsvReal Madrid (Arcos) Esports,0-1
28,04/07 09:30,-,Tottenham (DangerDim77) EsportsvBayern (nikkitta) Esports,4-1
29,04/07 09:30,-,Napoli (orlovsky1) EsportsvPSG (Boulevard_Prospect) Esports,0-1
0,04/07 12:36,-,Belgium (mooneycb) EsportsvSpain (Inquisitor) Esports,1-1
1,04/07 12:36,-,Portugal (Olle) EsportsvGermany (SALAYYY) Esports,0-0
2,04/07 12:30,-,Netherlands (nikkitta) EsportsvEngland (DangerDim77) Esports,0-0
3,04/07 12:30,-,Portugal (Boulevard_Prospect) EsportsvItaly (orlovsky1) Esports,0-2
4,04/07 12:24,-,Brazil (Chellovekk) EsportsvPortugal (Olle) Esports,0-0
5,04/07 12:24,-,Germany (SALAYYY) EsportsvBelgium (mooneycb) Esports,0-1
6,04/07 12:18,-,Portugal (Boulevard_Prospect) EsportsvEngland (DangerDim77) Esports,0-1
7,04/07 12:18,-,Spain (Arcos) EsportsvItaly (orlovsky1) Esports,2-1
8,04/07 12:12,-,Spain (Inquisitor) EsportsvGermany (SALAYYY) Esports,1-1
9,04/07 12:12,-,Belgium (mooneycb) EsportsvBrazil (Chellovekk) Esports,2-0
10,04/07 12:06,-,Netherlands (nikkitta) EsportsvPortugal (Boulevard_Prospect) Esports,1-0
11,04/07 12:06,-,England (DangerDim77) EsportsvSpain (Arcos) Esports,2-2
12,04/07 12:00,-,Portugal (Olle) EsportsvBelgium (mooneycb) Esports,2-0
13,04/07 12:00,-,Brazil (Chellovekk) EsportsvSpain (Inquisitor) Esports,0-0
14,04/07 11:54,-,Spain (Arcos) EsportsvNetherlands (nikkitta) Esports,0-1
15,04/07 11:54,-,Italy (orlovsky1) EsportsvEngland (DangerDim77) Esports,0-5
16,04/07 11:48,-,Arsenal (Chellovekk) EsportsvTottenham (SALAYYY) Esports,2-2
17,04/07 11:48,-,Man City (Olle) EsportsvLiverpool (Inquisitor) Esports,0-0
18,04/07 11:42,-,Portugal (Boulevard_Prospect) EsportsvSpain (Arcos) Esports,1-2
19,04/07 11:42,-,Netherlands (nikkitta) EsportsvItaly (orlovsky1) Esports,0-3
20,04/07 11:36,-,Liverpool (Inquisitor) EsportsvMan Utd (mooneycb) Esports,2-2
21,04/07 11:36,-,Tottenham (SALAYYY) EsportsvMan City (Olle) Esports,0-0
22,04/07 11:30,-,Italy (orlovsky1) EsportsvPortugal (Boulevard_Prospect) Esports,2-1
23,04/07 11:30,-,England (DangerDim77) EsportsvNetherlands (nikkitta) Esports,0-0
24,04/07 11:24,-,Man City (Olle) EsportsvArsenal (Chellovekk) Esports,1-4
25,04/07 11:24,-,Man Utd (mooneycb) EsportsvTottenham (SALAYYY) Esports,0-1
26,04/07 11:18,-,Napoli (orlovsky1) EsportsvReal Madrid (Arcos) Esports,1-1
27,04/07 11:15,-,Tottenham (DangerDim77) EsportsvPSG (Boulevard_Prospect) Esports,2-1
28,04/07 11:12,-,Tottenham (SALAYYY) EsportsvLiverpool (Inquisitor) Esports,2-1
29,04/07 11:12,-,Arsenal (Chellovekk) EsportsvMan Utd (mooneycb) Esports,0-0
0,04/07 14:36,-,PSG (Flewless_phoenix) EsportsvBayern (kalibra) Esports,0-3
1,04/07 14:36,-,Napoli (FEARGGWP) EsportsvTottenham (PASHOK75) Esports,1-1
2,04/07 14:30,-,Valencia (Olle) EsportsvAjax (mooneycb) Esports,0-0
3,04/07 14:30,-,Porto (Chellovekk) EsportsvMan Utd (Inquisitor) Esports,0-1
4,04/07 14:24,-,Real Madrid (taka) EsportsvNapoli (FEARGGWP) Esports,1-1
5,04/07 14:24,-,Tottenham (PASHOK75) EsportsvPSG (Flewless_phoenix) Esports,0-1
6,04/07 14:12,-,PSG (Flewless_phoenix) EsportsvReal Madrid (taka) Esports,3-1
7,04/07 14:12,-,Bayern (kalibra) EsportsvTottenham (PASHOK75) Esports,0-0
8,04/07 14:00,-,Napoli (FEARGGWP) EsportsvPSG (Flewless_phoenix) Esports,0-1
9,04/07 14:00,-,Real Madrid (taka) EsportsvBayern (kalibra) Esports,1-2
10,04/07 13:48,-,Brazil (Chellovekk) EsportsvGermany (SALAYYY) Esports,2-0
11,04/07 13:48,-,Portugal (Olle) EsportsvSpain (Inquisitor) Esports,0-1
12,04/07 13:36,-,Spain (Inquisitor) EsportsvBelgium (mooneycb) Esports,1-1
13,04/07 13:36,-,Germany (SALAYYY) EsportsvPortugal (Olle) Esports,0-1
14,04/07 13:24,-,Belgium (mooneycb) EsportsvGermany (SALAYYY) Esports,3-1
15,04/07 13:24,-,Portugal (Olle) EsportsvBrazil (Chellovekk) Esports,2-0
16,04/07 13:18,-,Italy (orlovsky1) EsportsvSpain (Arcos) Esports,2-1
17,04/07 13:18,-,England (DangerDim77) EsportsvPortugal (Boulevard_Prospect) Esports,1-1
